id,created_at,favorite_count,retweet_count,text
1100409759780356096,2019-02-26 14:58:26,0,0,". @PHE_uk reports that it is developing a syphilis action plan, and that getting access to testing and treatment quickly are key to reducing rates of syphilis.

#sexualhealth

Watch/listen here: https://t.co/f7j6sEqUQE https://t.co/dYhV1ASdBt"
1100409005787115521,2019-02-26 14:55:26,14,7,"Sexual health services are not just treatment services - they need to link to education and mental health services —@jimmcmanusph from  @ADPHUK 

#sexualhealth

Watch/listen here: https://t.co/f7j6sEqUQE https://t.co/Xdw2htB5Ub"
1100405989600243714,2019-02-26 14:43:27,3,3,"The session on #sexualhealth has started: on the first panel we have Prof John Newton from @PHE_uk and Prof Jim McManus from @ADPHUK 

Watch/listen here: https://t.co/f7j6sEqUQE https://t.co/ABABYfUMs3"
1100395789388517376,2019-02-26 14:02:55,7,1,"Our second and final evidence session on #sexualhealth starts today at 2.30pm. We'll be hearing from @BrineMinister, @PHE_uk, @ADPHUK  and @NHSEngland 
 
Watch/listen here: https://t.co/f7j6sE9jZ6 

Read more about the session here: https://t.co/t42NJ5Pmtd"
1100349699251470336,2019-02-26 10:59:46,13,11,"If a child’s body and brain develop well then their life chances are improved. Exposure to adversity during this period can result in a child’s development falling behind their peers.

Read the summary of our report on the #first1000days here: https://t.co/7ukZe5vQwD https://t.co/vJXVh7co2x"
1100304460721606656,2019-02-26 08:00:00,131,141,"Read our report on the #First1000days of life, published today: https://t.co/zMay4m3I47.
 
Find our recommendations to the Government here: https://t.co/eghO2pKjUp https://t.co/Kq39Mgq6jT"
1100184166476394496,2019-02-26 00:02:00,35,51,"Our report on the #first1000days of life is now published on our website. 
Read it here: 
https://t.co/zMay4lM6Fx
 
Find our press notice here: 
https://t.co/hbrTQXIFBV https://t.co/f0qpVdUHUQ"
1100066885222174721,2019-02-25 16:15:58,11,12,"Listen to Dr Menon-Johansson from @BrookCharity talking about the importance of prevention at our last session on #sexualhealth. 

Tune in tomorrow at 2.30pm when we’ll be questioning @BrineMinister in our final session of this inquiry. 

Read more here: https://t.co/t42NJ5Pmtd https://t.co/WjN6uedi99"
1099984337271967745,2019-02-25 10:47:57,10,8,"Read our report on the #First1000days of life from 00.01am tomorrow, Tuesday 26th February, on our website: https://t.co/y4HBgEXevv https://t.co/4GUkDq3SYH"
1098603283168546821,2019-02-21 15:20:08,7,8,"*Change of publication date*: the report on the #First1000days will be published on Tuesday 26 February at 00.01am, instead of Monday 25 February as previously announced. https://t.co/0PYKfnJ0bz"
1098593775654457345,2019-02-21 14:42:21,1,0,"@emmagadie2009 Hi Emma. Sorry you're having trouble uploading your submissions. We've tested the portal and found no issues. Please try again or give it some time and try later with a different browser. If the issue persists, give us a call."
1098184863545470979,2019-02-20 11:37:29,3,4,"Yesterday, MPs debated the #NHSLongTermPlan in the Commons. We recently held a session on the same topic. 

Rewatch here: https://t.co/HvgpGeVbND

Read the transcript here: https://t.co/IvwfrQP15m https://t.co/L275XQcaeh"
1097795863072698368,2019-02-19 09:51:44,28,20,"We have an open call for written submissions on the availability of #Orkambi and other drugs from Vertex on the NHS. Any individual or organisation can submit evidence. Send your submissions in by Monday 25 February. 

Read more here: https://t.co/fNa6KsVclp https://t.co/lSDLaAqqnC"
1096348767140409344,2019-02-15 10:01:29,7,10,The Liaison Committee is holding an inquiry into the effectiveness of select committees. How can we be more effective? The Liaison Committee wants to hear your views below. https://t.co/cUifb0JBrp
1095744427539267584,2019-02-13 18:00:04,6,7,"@JadeTaylor8 Hello. We will hold an evidence session on the Kark Report on 12th March. We are afraid we cannot accept evidence sent via Twitter but information on the session, and on how to submit evidence, can be found at this link: https://t.co/yrKKIBDv6O"
1095741675643772930,2019-02-13 17:49:08,2,5,"We are holding an evidence session examining the findings and recommendations of the Kark report on 12 March. 

Read more here: https://t.co/yrKKIBDv6O https://t.co/KqLL6kdl0T"
1095332737307750407,2019-02-12 14:44:09,11,4,"We would like to thank @UHP_NHS @TheZonePlymouth @plymouthcc for talking to us about #sexualhealth services in Plymouth and the people who attended our focus groups.

Visit this link to catch up with our inquiry on #sexualhealth: https://t.co/IPrEZYtkt7 https://t.co/zBR5upoZE3"
1094896301093908481,2019-02-11 09:49:55,8,11,"We have published the transcript from last week's session on #SexualHealth. 

Read it here: https://t.co/oKBQILlM9l https://t.co/f1ECmGyBmR"
1093194456382259205,2019-02-06 17:07:23,13,14,"This #ChildrensMentalHealthWeek, we urge the Government to place children and young people’s well-being  at the heart of their policy. 

Read about our joint report with @CommonsEd here: https://t.co/h3zOZMmrUR https://t.co/sNF3sMdzPe"
1092826560967704577,2019-02-05 16:45:30,19,16,"Our session on #sexualhealth has now finished, thank you to all the witnesses who came to speak to us.

You can rewatch the session here: https://t.co/G5zu0v8Hwr https://t.co/fACVbQPsD4"
1092825323945762817,2019-02-05 16:40:35,22,18,"“Everybody, regardless of age, needs good quality, up to date, sexual health information” — says @ianrgreen from @THTorguk

Watch our session on #sexualhealth here: https://t.co/G5zu0v8Hwr https://t.co/BjqNvFRQ0l"
1092823105247027202,2019-02-05 16:31:46,9,13,"“We need a clear, coherent national sexual health strategy....currently we are all operating in a vacuum” —@ianrgreen from @THTorguk

Watch our session on #sexualhealth here: https://t.co/G5zu0v8Hwr https://t.co/w8biye0u03"
1092821919605444615,2019-02-05 16:27:03,16,9,"""There is no national advisor, no national agenda: there is nothing that says that we have to have a strategy for BME people, especially for BME women"", says Dr Anatole Menon-Johansson from @BrookCharity

Watch our session on #sexualhealth here: https://t.co/G5zu0v8Hwr https://t.co/AriRFpTMIL"
1092821253843550209,2019-02-05 16:24:25,7,1,"""Testing for Trichomonas vaginalis, which increases the risk of HIV acquisition, is not funded across the UK"" —says  Dr Anatole Menon-Johansson from @BrookCharity

Watch our session on #sexualhealth here: https://t.co/G5zu0v8Hwr https://t.co/7KAxMfftm2"
1092819294562541568,2019-02-05 16:16:38,3,1,"""A reduction in funding has resulted in reduced ability to involved the community you are serving""—says Laura Russell from @stonewalluk https://t.co/eUUJv0QuXC"
1092818893171838976,2019-02-05 16:15:02,15,9,"“A consequence of budget cuts has been that prevention has been cut. The tailored, targeted approach that we know works has been decimated”—says Marion Wadibia from @NazProjectLdn

Watch our session on #sexualhealth here:  https://t.co/G5zu0v8Hwr https://t.co/HObPXxTxue"
1092816932187840512,2019-02-05 16:07:14,7,5,"“We need services that are going out to groups that are not able to access them” — Dr Anatole Menon-Johansson, @BrookCharity

Watch our session on #sexualhealth here: https://t.co/G5zu0v8Hwr https://t.co/qjzecWlsWr"
1092816376308350976,2019-02-05 16:05:02,12,3,"""80% of women living with HIV are from BAME groups""  —Marion Wadibia from @NazProjectLdn

Watch our session on #sexualhealth here: https://t.co/G5zu0v8Hwr https://t.co/gl0s086iJ9"
1092813984540119040,2019-02-05 15:55:32,14,15,"We are now on to the second panel on #sexualhealth. We are hearing representatives from @THTorguk, @NazProjectLdn, @stonewalluk,
and the @BrookCharity. 

Find the live stream here: https://t.co/G5zu0v8Hwr https://t.co/LSPSdlOZWZ"
1092807359381073920,2019-02-05 15:29:12,2,4,".@ianhudspeth: “We have to be realistic about where we are with the funding stream and actually get the best of what we've got rather than trying to change the whole system”

Watch our session on #sexualhealth  here: https://t.co/G5zu0v8Hwr https://t.co/NyPZ8u039T"
1092802825132933121,2019-02-05 15:11:11,19,10,"""Every pound spent on contraception saves ten pounds and that is Public Health England's figures, not ours""— Dr Asha Kasliwal, @FSRH_UK 

Watch our session on #sexualhealth here: https://t.co/G5zu0v8Hwr https://t.co/pTZFQHps4i"
1092800662319128582,2019-02-05 15:02:35,15,4,"Fragmentation of commissioning is one of the many reasons that cervical screening is going down — Dr Asha Kasliwal, @FSRH_UK 

Watch our session on #sexualhealth here: https://t.co/G5zu0v8Hwr https://t.co/AZ8KxR2cL3"
1092798258517340165,2019-02-05 14:53:02,18,13,"""Cuts hit the most deprived the most severely...leading to increased inequalities"" —Dr Anne Connolly, @rcgp 

Watch our session on #sexualhealth  here:  https://t.co/G5zu0v8Hwr https://t.co/xtwahs8J5K"
1092797186201538560,2019-02-05 14:48:47,5,3,"""There has been a loss of holistic healthcare... separating the sex out of the rest of health care"" —Dr Anne Connolly, @rcgp 

Watch our session on #sexualhealth here:  https://t.co/G5zu0v8Hwr https://t.co/a7lrriG23w"
1092796616086601729,2019-02-05 14:46:31,8,8,"""More and more, women are not getting access to contraception, which is a basic need"" — Dr Asha Kasliwal, @FSRH_UK 

#sexualhealth

Watch live  here:  https://t.co/G5zu0v8Hwr https://t.co/KgtOQUJYIl"
1092795725635878917,2019-02-05 14:42:58,3,5,"47% of people do not use a condom in their first sexual experience with a new partner, according to @BASHH_UK 

#sexualhealth

Watch live  here: https://t.co/G5zu0v8Hwr https://t.co/XRyaExeUXZ"
1092793846059159552,2019-02-05 14:35:30,13,9,"Our session on #sexualhealth is starting now. 

On the first panel, we have @ianhudspeth from @LGANews, Dr Olwen Williams from @BASHH_UK,  Dr Anne Connolly from @rcgp  and Dr Asha Kasliwa from @FSRH_UK 

Find the live stream here:  https://t.co/G5zu0v8Hwr"
1092737273991438336,2019-02-05 10:50:42,8,9,"Tune in at 2.30pm today to listen to our first session on #sexualhealth services.

We'll be hearing from @LGANews @BASHH_UK @rcgp  @FSRH_UK @THTorguk @NazProjectLdn @stonewalluk and @BrookCharity 

Watch live here: https://t.co/G5zu0v8Hwr. https://t.co/Qman53wbAd"
1092720718029246465,2019-02-05 09:44:55,12,26,"We have an open inquiry into medicinal cannabis. The deadline to submit written evidence is this Friday. 

Read more here: https://t.co/9Hjh8cwHqc https://t.co/TWewM9fXI5"
1092462092513431553,2019-02-04 16:37:14,70,86,"We are launching a new inquiry into drugs policy and we want to hear your views. 

Find more information, including the terms of reference, on our website: https://t.co/XIOmFQD6Ni https://t.co/2AdcMLWTmU"
1091378191925682176,2019-02-01 16:50:12,11,6,"We are holding our first evidence session on #sexualhealth on Tuesday 5 February.

Find out more, including the list of witnesses, here: https://t.co/C0wark4tyc https://t.co/4DDb19gqQD"
1091026799620960260,2019-01-31 17:33:53,12,10,"Today @NHSEngland announced “an army of 20,000 more staff to help GP practices work together"", implementing the recommendation of our 2016 report on #primarycare.
Read NHSE's announcement here: https://t.co/lrHG06ZHXa

Read our report here: https://t.co/kfxUmZrkmm https://t.co/FV13YQ5RFL"
1091015142337323008,2019-01-31 16:47:34,1,1,Read the Government’s response to our report on #childhoodobesity here: https://t.co/LUCOaO97KJ
1090934652293050368,2019-01-31 11:27:44,12,13,"We have published further documents from Vertex, NHS England and NICE relating to the availability of Orkambi on the NHS. 

Read more here: https://t.co/dZJ4XKjmkO"
1089952804624572416,2019-01-28 18:26:13,3,1,"Our second and final session on the #NHSLongTermPlan is now finished. You can listen to the session back here, https://t.co/HvgpGeVbND, and a transcript will be published in due course. Thank you for tuning in. https://t.co/NpdApXbQ9u"
1089942915651112963,2019-01-28 17:46:55,2,6,"“The commitment is that there will be no further pressure on the NHS from social care” — says Secretary of State @MattHancock  

#NHSLongTermPlan 

Watch live here:  https://t.co/HvgpGeVbND https://t.co/vE5eGeRkib"
1089937374358982657,2019-01-28 17:24:54,5,10,".@MattHancock: ""There is no privatisation of the NHS on my watch. The integrated care contracts will go to public sector bodies to deliver the NHS in public hands”

#NHSLongTermPlan 

Watch live here:  https://t.co/HvgpGeVbND https://t.co/xjlbcStyoa"
1089933984400850944,2019-01-28 17:11:26,2,6,"“Funding for mental health is going to rise in the #NHSLongTermPlan, but funding for children and adolescent mental will rise even faster”, confirms Simon Stevens, CEO of @NHSEngland . 

Watch live here:  https://t.co/HvgpGeVbND https://t.co/8XxOorW1iA"
1089930426687389696,2019-01-28 16:57:18,0,0,".@MattHancock —  ""In @DHSCgovuk we look at the civil contingencies act. It is an option all the time for all sorts of considerations. We're always planning for things that we don’t want to happen""

#NHSLongTermPlan

Watch live here:  https://t.co/HvgpGeVbND https://t.co/msNTXT1RAu"
1089926871012261889,2019-01-28 16:43:10,3,9,"Health and Social Care Secretary @MattHancock confirms that medicines will be prioritised over food in the event of disruptions in supply due to Brexit. 

#NHSLongTermPlan

Watch live here:  https://t.co/HvgpGeVbND https://t.co/leXq3uaazj"
1089926421848432643,2019-01-28 16:41:23,0,3,"""NHS Brexit contingency plans have now been activated"", says Simon Stevens, ""covering logistics arrangements for both clinical and non-clinical supplies""

#NHSLongTermPlan

Watch live here:  https://t.co/HvgpGeVbND https://t.co/YySOVAq9Wp"
1089921032356532225,2019-01-28 16:19:58,0,0,"“Productivity is hardwired into this plan”, says @NHSImprovement CEO Ian Dalton. “We are expecting the NHS overall to improve efficiency by 1.1%, but we are asking trusts in deficit to deliver an extra 0.5%.”

#NHSLongTermPlan

Watch live here:  https://t.co/HvgpGeVbND"
1089920216052781057,2019-01-28 16:16:43,9,13,"""We know we have to expand the workforce now""—says Ian Dalton, CEO of @NHSImprovement. ""An interim workforce plan will set out workforce plans in broad terms in the next few months, along with specific measures for 2019-20""

Watch live here:  https://t.co/HvgpGeVbND https://t.co/AIwj8KBiAF"
1089915830333329408,2019-01-28 15:59:18,6,14,"Our second session on the #NHSLongTermPlan is about to start. We are hearing from the Secretary of State @MattHancock, Simon Stevens from @NHSEngland, Prof Ian Cumming from @NHS_HealthEdEng and Ian Dalton from @NHSImprovement. 

Watch live here:  https://t.co/HvgpGeVbND https://t.co/0xi0RYoVSx"
1089856304175288321,2019-01-28 12:02:46,10,3,Thank you to @HealthwatchE for putting this video together for us.
1089846502263058432,2019-01-28 11:23:49,23,41,"At 4pm today we are questioning the Secretary of State for Health and Social Care and NHS Chief Executives on the #NHSLongTermPlan. Here are some questions members of the public would like to ask. 

Watch the session live here: https://t.co/HvgpGeVbND https://t.co/V3YMrbNl3r"
1089832447016140800,2019-01-28 10:27:58,4,6,"The original STPs, in our view, got off to a poor start. In our #integratedcare report we concluded that poor consultation, communication and financial constraints resulted in STPs being labelled as a smokescreen for cuts.  

Our session on the #NHSLongTermPlan is at 4pm today https://t.co/1r7Dqp5TZY"
1088839251687628801,2019-01-25 16:41:21,9,9,"We heard from thinktanks and stakeholders on the #NHSLongTermPlan. Listen to @RichardDMurray1 talking about cuts to public health.

On Mon 28th at 4pm we’ll hear from the Secretary of State @MattHancock and the NHS Chief Executives. Read more here: https://t.co/9MmWCJGXNQ https://t.co/yE82SEY4e3"
1088799102559768576,2019-01-25 14:01:49,5,4,"Our report on #integratedcare concluded that the law needs to change, but big questions remain about when, and how, to legislate.  

Read the conclusion from our report on integrated care here: https://t.co/HDmB5oyNnR

Our session on the #NHSLongTermPlan will be on Monday 28th https://t.co/eWbuRzLCXL"
1088488912501334017,2019-01-24 17:29:14,14,18,"Change of date: the second session on the #NHSLongTermPlan will be on Monday 28 January at 4pm. 
We’ll be hearing from @MattHancock  @NHSEngland @NHSImprovement and @NHS_HealthEdEng 

Read more here: https://t.co/L91b3NgMDu https://t.co/rsvWjN1T45"
1088430413469634560,2019-01-24 13:36:47,43,31,"We are holding a session on the availability and pricing of #Orkambi and other drugs manufactured by Vertex on the NHS and we are inviting written submissions. 

Read more here: https://t.co/pLtPZeeqXA https://t.co/zVPd04PFas"
1088392847097774081,2019-01-24 11:07:30,0,5,"In our #antimicrobialresistance report we recommended more challenging targets to reduce the inappropriate use of antibiotics. We are pleased to see that the Government’s new strategy has done this.
 
Read the Government’s response to our report here: https://t.co/flCzF1wc1u https://t.co/E3XqOQ7p48"
1087775117739020288,2019-01-22 18:12:52,7,6,"Our session on #SuicidePrevention has now finished. Thank you to all of our witnesses. 
 
You can rewatch the session here: https://t.co/ilj1Ww1Rnc"
1087767731024351232,2019-01-22 17:43:31,3,4,"After 5 votes in the Chamber, we can now resume our session on #SuicidePrevention. We are hearing from @JackieDP, @timkendall1 and Prof John Newton from @PHE_uk 

Watch live here:  https://t.co/ilj1Ww1Rnc"
1087764924410015749,2019-01-22 17:32:22,0,0,"@BBCAlicia @JackieDP @timkendall1 @PHE_uk Hello, we'll have further information after the votes."
1087750046098038786,2019-01-22 16:33:15,0,3,"Our session on #suicideprevention is currently suspended due to votes in the House of Commons. After the votes we’ll be hearing from @JackieDP, @timkendall1 and @PHE_uk 

Watch live here:  https://t.co/ilj1Ww1Rnc"
1087749198173360128,2019-01-22 16:29:52,60,30,".@ProfLAppleby emphasises the need for people to receive follow up support within three days of discharge from mental health services.

#SuicidePrevention https://t.co/LJemTzmSMi"
1087734231487447046,2019-01-22 15:30:24,3,5,".@SamaritansRuth —""The IPSO code isn't good enough, and it isn't being followed."" 
#SuicidePrevention https://t.co/ErQAvlaS8p"
1087732932259823623,2019-01-22 15:25:14,12,6,".@hamishelvidge ""A lot of people don’t seek help because of the stigma association. Stigma is built out of lack of understanding and lack of understanding is built out of lack of education. We need to get to a place where young people understand the importance of mental health"" https://t.co/tbK1ZL2Tmq"
1087729966291263489,2019-01-22 15:13:27,8,5,".@SamaritansRuth comments on duplication and lack of evidence base for suicide prevention interventions: ""Why are we not making it easier for local authorities to spend their money more wisely?""

#SuicidePrevention https://t.co/42HEnTXIqJ"
1087728839801950208,2019-01-22 15:08:59,15,13,".@cllrkemp — ""People are falling through the net right at the basic level, before they start to get suicidal. Because the parks aren't running properly, the libraries aren't. This is why policies have to be across the whole of the council.""

#SuicidePrevention https://t.co/nfFyms9Kfz"
1087725297666011139,2019-01-22 14:54:54,9,5,".@DrP8ken highlights the importance of workforce saying that services with high turnover and high use of agency staff tend to be less safe. 

#SuicidePrevention https://t.co/xafua9glHw"
1087721175181152258,2019-01-22 14:38:31,10,11,"Our evidence session on #suicideprevention is starting now: on the first panel we have @SamaritansRuth @DrP8ken @cllrkemp @hamishelvidge

Watch live here:  https://t.co/ilj1Ww1Rnc"
1087666592622829568,2019-01-22 11:01:38,2,2,From 2.30pm we'll be hearing from @SamaritansRuth @DrP8ken @cllrkemp @hamishelvidge @ProfLAppleby and at 3.45pm from @JackieDP @timkendall1  and @PHE_uk
1087665440577540096,2019-01-22 10:57:03,2,8,".@DHSCgovuk has published its progress report on Preventing Suicide in England. Hear stakeholders’ views on this at our session on #SuicidePrevention 

Watch our session from 2.30pm today here: https://t.co/0dE1poa8n6

Read the Government’s report here: https://t.co/MQjfSh4K0t https://t.co/7NiU1jKzjL"
1086322578933727232,2019-01-18 18:01:00,0,8,"Last chance to let us know your opinion on #sexualhealth services. Fill out our anonymous survey by 10 am on Monday 21 January. Your views will be an important part of our inquiry into sexual health.

Click here to access the survey: https://t.co/0Jj45SScza https://t.co/hRNl0XKGo9"
1086300788639612930,2019-01-18 16:34:25,4,4,"On Tuesday 15 January we held our first session on the #NHSLongTermPlan. 

Read the transcript here: https://t.co/kEU8yCLqtb

Watch or listen to the session back here: https://t.co/yZrfFXU7hx

Next session on the NHS Long-Term Plan: Tuesday 29th Jan at 2.30pm https://t.co/bKhZDk6tBn"
1085574929188339713,2019-01-16 16:30:06,11,15,"Our survey on #sexualhealth services is open until Monday 21 Jan. Let us know what you think of sexual health services and help us spread the word: we want to hear from as many users as possible!

Click here to access the survey: https://t.co/0Jj45SABHC https://t.co/E081P5okBu"
1085546857441476616,2019-01-16 14:38:33,2,0,"Next week we’ll hear from the Minister for Suicide Prevention @JackieDP on what progress the Government has made on implementing the recommendations made in our 2017 report on #suicideprevention. 

More info on the session here: https://t.co/cpOGlP7ozr https://t.co/po05aKvOD4"
1085217475032240129,2019-01-15 16:49:43,8,15,"Our first session on the #NHSLongTermPlan is now finished. Thank you to all the witnesses who came to speak to the Committee.  The second session will be on Tuesday 29th January.

To watch again today’s session, click here: https://t.co/GKcV3IESjC https://t.co/P9qLo65FA7"
1085212135301566465,2019-01-15 16:28:29,49,41,"""We shouldn’t be scared of working with the voluntary sector. Some of those organisations are providing really good outcomes and local ideas. We should be enhancing those and supporting the voluntary sector and not just seeing it as an add-on"" —@ianhudspeth

#NHSLongTermPlan https://t.co/6wgVg8mJD2"
1085207396170063872,2019-01-15 16:09:40,14,12,"“The investment in primary and community care is welcome but that is against the backdrop of significant underfunding of those sectors over the past ten years”— @DrNavChana

#NHSLongTermPlan 

Watch live: https://t.co/GKcV3IESjC https://t.co/2p34T3Wzi9"
1085206098641076225,2019-01-15 16:04:30,22,25,"“I think I can make a relatively confident prediction here today that everything in this plan is not going to be delivered. There is just simply too much to do for the money and workforce we have available” — @ChrisCEOHopson #NHSLongTermPlan 

Watch live: https://t.co/GKcV3IESjC https://t.co/sjYlNnuqKf"
1085202332365832194,2019-01-15 15:49:32,5,7,"Now moving on to the second panel, with @ChrisCEOHopson @NhsccJ @DrNavChana and @ianhudspeth

#NHSLongTermPlan 

Watch live: https://t.co/GKcV3IESjC https://t.co/Hp3JPVEafX"
1085198343712763904,2019-01-15 15:33:41,6,9,"Since 2006/07, the slice of the NHS budget allocated to education and training has fallen from 5% to 3%, a drop of around £2bn, according to the Nuffield Trust CEO, @nedwards_1 

#NHSLongTermPlan 

Watch live: https://t.co/GKcV3IESjC https://t.co/UsUroTzdEA"
1085194989515075590,2019-01-15 15:20:22,23,10,"“There is a need for more cross-government action nationally to address health inequalities” —@JenniferTHF 

#NHSLongTermPlan 

Watch live: https://t.co/GKcV3IWtba https://t.co/CuGoRxz9Zr"
1085194086384951296,2019-01-15 15:16:46,11,14,"“Not publishing the social care green paper alongside the NHS Long-term Plan was a missed opportunity”, says  @NHSC_Niall 

#NHSLongTermPlan 

Watch live: https://t.co/GKcV3IWtba https://t.co/Gmkaelt3dk"
1085193586759458816,2019-01-15 15:14:47,9,19,".@nedwards_1 ""The proposal is to provide better care in community and primary care to reduce the need for future hospital expenditure, and I think that is more achievable than some of the models we have seen to try use integrated care to reduce demand"" 
 
 #NHSLongTermPlan https://t.co/8qb47RbOqP"
1085184353150263301,2019-01-15 14:38:06,3,6,".@NHSC_Niall —""There is a fundamental tension at the heart of the plan ... how do you deal with the existing constitutional standards while moving to a new system?”
 
#NHSLongTermPlan 
 
Watch live: https://t.co/GKcV3IWtba https://t.co/J7VXzvk1WG"
1085181893853626369,2019-01-15 14:28:19,4,2,"The first panel on #NHSLongTermPlan is starting now, with @RichardDMurray1 from @TheKingsFund, @nedwards_1 from @NuffieldTrust, @JenniferTHF from @HealthFdn  and @NHSC_Niall from @nhsconfed.
 
Watch live: https://t.co/GKcV3IWtba"
1085133739007578113,2019-01-15 11:16:58,53,48,"We will be holding the first session on #NHSLongTermPlan today at 2.30pm. The first panel will hear from @TheKingsFund @NuffieldTrust @HealthFdn @nhsconfed. The second panel will hear from @NHSProviders @NAPC_NHS @LGAWellbeing @NHSCCPress. 

Watch live: https://t.co/GKcV3IESjC"
1084848635534299137,2019-01-14 16:24:04,2,4,"The Government have replied to our report on #prisonhealth. Read their response here: https://t.co/iubr5LmPMp

Our report can be found here: https://t.co/QXPEHXp0uP https://t.co/nhSJmC4pVU"
1084829785531011083,2019-01-14 15:09:10,1,3,"Today is #STIQDay. If you have used sexual health services, please contribute to our survey for our #SexualHealth inquiry. 

https://t.co/0Jj45SABHC"
