id,created_at,favorite_count,retweet_count,text
1346472774974337026,2021-01-05 15:05:00,22,28,"Everyone is feeling the impact of COVID-19 on their lives, including teenagers and young people. If you need support see https://t.co/VrblhGIXKi to find out about online resources and help available.
@NIYF
@voypic
@cypsp
@Actn4ChildrenNI
@nichildcom
@Ed_Authority
@Education_NI https://t.co/PsxAvYNNrR"
1346454575474212864,2021-01-05 13:52:41,7,4,"Vaccines are designed to prevent people from getting serious infectious diseases. Read more: https://t.co/znsNPjMQNV 
@healthdpt https://t.co/tHpgS6i6kZ"
1346443329953820672,2021-01-05 13:08:00,7,9,"Online antenatal classes - stay at home while getting ready for baby; you can now avail of the free online course for parents, grandparents and carers across Northern Ireland.
#gettingreadyforbaby #pregnancy #newbaby https://t.co/pKnmwRgxeA"
1346396024072511489,2021-01-05 10:00:01,8,6,"Vaccinations are the most effective public health intervention in the world for saving lives and promoting good health. Dr Claire Neill explains.
 
Read more: https://t.co/GRoi7m9Y0x

#vaccines #COVID19 https://t.co/0EX84qAc5C"
1346169528036646912,2021-01-04 19:00:00,20,28,"Travelling into and staying in Northern Ireland? You need to self-isolate for 10 days from your date of arrival.

For more information, including on exemptions, see https://t.co/GiOI7lPa7Q https://t.co/VXmsqFVWge"
1346139326757801987,2021-01-04 17:00:00,8,8,If you test +tive for #COVID19 we will ask you to tell us about people you have been in #closecontact with. Think about where you’ve been and who you may have met in the period from 48 hours before your symptoms began until now. For more info @ https://t.co/rkxGQbBCpa https://t.co/NHFeClRvSx
1346109131539812353,2021-01-04 15:00:01,2,5,"Don't forget the symptoms of COVID-19.If you experience either a new continuous cough, high temperature, or a loss of, or change in sense of smell or taste, get tested. 
Find out more at https://t.co/lSisoZ0qep https://t.co/OHo4mk2gPr"
1346063833517813761,2021-01-04 12:00:01,6,11,"Keep following the public health advice for #COVID19 – these steps may seem simple, but they are effective in reducing the spread. More info @ https://t.co/fmM1Isv1Dn https://t.co/RgK1EUAE1F"
1346033631760769025,2021-01-04 10:00:00,6,11,"*Self-Isolation Update* 

If you are a close contact of someone who tests positive for #COVID19, you must self-isolate for 10 days. 

It had been 14 days. 

Self-isolation means you must stay at home, away from others.

More info at https://t.co/lSisoYIOPP https://t.co/2n72dABjEb"
1345776942851698701,2021-01-03 17:00:01,16,9,"Be a hero in your community.

Wear a face covering over your nose and mouth. Keep your distance. Wash your hands.

It could save lives. https://t.co/V2KpvBTCiy"
1345746742264778753,2021-01-03 15:00:00,51,62,"Free online Stress Control classes will start again on Monday 11th January. The classes last for 6 weeks and will 'give you the tools to help you cope and become your own therapist', as one of the previous participants said of his experience.
More info @ https://t.co/KFPKMKpAqC https://t.co/g9K2us3RIN"
1345716544517648385,2021-01-03 13:00:01,1,4,"Learn more about Digital Self-Trace, the online contact tracing service, and how it helps stop the spread of coronavirus. #TestTraceProtect
Visit: https://t.co/MhmzvhrLTg https://t.co/jpTVpkIxV3"
1345671244696281089,2021-01-03 10:00:00,5,6,"With #TestTraceProtect anyone of us could be asked to self-isolate at any time. 

These tips for planning ahead will help make it easier if you are asked to stay at home. 

Learn more at https://t.co/GiOI7lPa7Q https://t.co/cCIO5AEuRY"
1345474950090600449,2021-01-02 21:00:00,5,5,"Mixing alcohol and cocaine can kill. Alcohol and cocaine in the bloodstream can form a toxic substance known as ’cocaethylene’ and can cause fatal heart problems.

Don't mix any drugs.

Find out more at https://t.co/BSFooX7slM

@NIDACTS @niada_info https://t.co/wJMHT9SkeK"
1345437201157431299,2021-01-02 18:30:00,4,6,"If you have the symptoms of COVID-19 don't delay - get a test straight away. 

If you experience either a new continuous cough, or high temperature, or a loss of, or change in sense of smell or taste, get tested. 

Find out how at https://t.co/CoceczdLvs https://t.co/ppCu203ZBT"
1345399453927284737,2021-01-02 16:00:00,1,0,"A #hangover might make you feel bad for a day or so, but regularly drinking too much can seriously damage your #health.

Start to take control of your #drinking and find steps to reduce the risks associated with #alcohol by visiting https://t.co/IsLhW1hxBZ

@NIDACTS @niada_info https://t.co/4zDl6gdYnC"
1345354153221115909,2021-01-02 13:00:00,1,0,"How do walk-through #COVID19 test sites work? 

Watch the video below to find out https://t.co/rZY2ylxivJ"
1345339305439367168,2021-01-02 12:01:00,28,16,"If you’re contacted by the Contact Tracing Service, follow the advice to self-isolate if you’ve tested positive or are a close contact of a positive case. https://t.co/112LbH1sbn"
1345308858890088449,2021-01-02 10:00:01,22,22,"If you're waiting for a COVID-19 test, or a test result, you and everyone in your household must self-isolate.

Stopping the spread of the virus helps save lives. Find out more at https://t.co/lSisoYIOPP

@healthdpt https://t.co/IgftVlkaHq"
1345067262948958215,2021-01-01 18:00:00,25,29,"The number (028) 9536 8888 will show on your phone if the Contact Tracing Service tries to ring you. Save this number on your phone now, so you can recognise it and take the call. Taking this simple step now could help save you and your close contacts valuable time if contacted. https://t.co/iDdVv9pRAj"
1345037281162375169,2021-01-01 16:00:52,4,2,"If you have any of the symptoms of COVID-19 – a new continuous cough, or a high temperature, or a change in your sense of taste or smell – book a test . Info at https://t.co/CoceczvmU2 Don’t forget while you’re waiting for your test or test result, you must self-isolate. https://t.co/VIxOIVYGEB"
1344991961275658243,2021-01-01 13:00:46,0,0,Want to give up smoking this New Year? We can help. Info at https://t.co/9PdBB0qTUl https://t.co/xGLWqsCQOZ
1344946571650195456,2021-01-01 10:00:25,4,3,"Not a whizz in the kitchen but want to eat better in the New Year? We have tons of easy, quick and tasty recipes that can have you eating healthier in no time. Over 80 recipes for you to https://t.co/YGNwFhEoXQ #healthyrecipe #choosetolivebetter https://t.co/wUBhLEOh57"
1344643498822266881,2020-12-31 13:56:07,4,4,"Learn more about Digital Self-Trace, the online contact tracing service, and how it helps stop the spread of coronavirus. #TestTraceProtect
Visit: https://t.co/MhmzvhrLTg https://t.co/AgUbjvRWVR"
1344629379402498049,2020-12-31 13:00:00,2,5,"SAVE THE DATE: If you want to find out more about the public consultation on organ donation, join one of our virtual public engagement sessions: 
12 Jan 1pm;
13 Jan 7.30pm;
19 Jan 7.30pm;
20 Jan 1pm.
Registration links to follow. 
Or have you say today at https://t.co/OJ4QkdDN8K https://t.co/QAO5eCRaNc"
1344614281766047747,2020-12-31 12:00:01,4,9,Multi-Agency Triage team (MATT) Crisis De-escalation Service -available for those experiencing an acute mental health crisis that are in contact with emergency services by phoning 999 or 101 in Belfast and South Eastern Trust areas. To find out more visit https://t.co/RsQ6o8KbS7 https://t.co/Ve7k28snvD
1344327388151255040,2020-12-30 17:00:00,0,0,"People with STIs often don’t have symptoms, so anyone having unprotected sex could be putting both their health and their partners at risk. If you have put yourself at risk there are GUM clinics open for appointments, you can find information on https://t.co/hx1l9TCJJ9 https://t.co/QuxrSypAKT"
1344297196661788673,2020-12-30 15:00:02,3,3,"Seasons Greetings and happy holidays…a time to think about a special kind of gift, the gift of life. One donor can save or improve up to 9 lives, so why not take some time over the holidays to join the Organ Donor Register and share your decision with your family. https://t.co/JxLRm9Dymi"
1344282090389471232,2020-12-30 14:00:00,1,3,"There are a number of online Breastfeeding Support Groups available, they're open to pregnant women and new mums and are a great opportunity to meet with other mums and get any questions you may have answered. 

Visit https://t.co/QiVQ6uRiiy for more info. https://t.co/uRL8sUAkrS"
1344236825653747712,2020-12-30 11:00:08,10,6,"With more of us being indoors, we will struggle to get all of the vitamin D needed, we are encouraging everyone from age 1 onwards to take a 10 microgram supplement of vitamin D daily. 
For more information on vitamin D please visit the PHA website at https://t.co/EXLXD602pI https://t.co/Ucm0b12Njs"
1343980104028979201,2020-12-29 18:00:01,6,7,"If you have been identified as a 'close contact' you need to self-isolate for 10 days. Find out what that means below.
For further information visit https://t.co/lSisoZ0qep https://t.co/8f2cPVXT8g"
1343934805508059137,2020-12-29 15:00:01,26,12,"Dr Naomh Gallagher, Research and Development Programme Manager at the PHA talks about vaccine safety and effectiveness. https://t.co/CAAqH8icCd"
1343859307213942785,2020-12-29 10:00:01,10,10,"Parents don’t ignore signs of #type1diabetes during COVID-19 pandemic or because of Christmas holidays.
Children can develop #type1diabetes at any time – if symptoms develop, get your child’s blood sugar checked that day.
For further information see https://t.co/sNnZJGnNa3 https://t.co/utx1dG6P7C"
1343617713613107200,2020-12-28 18:00:00,3,8,If you test +tive for #COVID19 we will ask you to tell us about people you have been in #closecontact with. Think about where you’ve been and who you may have met in the period from 48 hours before your symptoms began. For more info @ https://t.co/rkxGQbBCpa https://t.co/wKzj1zzAjv
1343572420645580802,2020-12-28 15:00:02,2,4,"Don't forget the symptoms of COVID-19.If you experience either a new continuous cough, high temperature, or a loss of, or change in sense of smell or taste, get tested. 
Find out more at https://t.co/lSisoZ0qep https://t.co/64RfAJ0LRf"
1343527114893623296,2020-12-28 12:00:00,4,5,"Keep following the public health advice for #COVID19 – these steps may seem simple, but they are effective in reducing the spread. More info @ https://t.co/fmM1IsdqLP https://t.co/qYTwIytOZq"
1343512113625632768,2020-12-28 11:00:23,3,3,Vaccines are essential for your protection from infection. Our leaflet has information on why vaccination is so important. To get a copy go to your local community pharmacy or download at https://t.co/H7w6pLxzta #LivingWell #vaccines https://t.co/TVxgRxntrw
1343496918043820033,2020-12-28 10:00:00,10,6,"*Self-Isolation Update* 

If you are a close contact of someone who tests positive for #COVID19, you must self-isolate for 10 days. 

It had been 14 days. 

Self-isolation means you must stay at home, away from others.

More info at https://t.co/lSisoYIOPP https://t.co/YlPQyAKZkC"
1343225125441830917,2020-12-27 16:00:00,0,1,"If you test +tive for coronavirus, help keep your loved ones safe by using Digital Self-Trace. It allows contact tracers to alert people you’ve had close contact with as quickly as possible, helping to stop the virus spreading. #TestTraceProtect 
Info @ https://t.co/MhmzvhrLTg https://t.co/jN06exvrwb"
1343179830574145540,2020-12-27 13:00:01,29,22,"PHA is supporting the ‘We’ll Get Through This Together’ campaign developed by NI's Mental Health Champion  @profsiobhanon in partnership with #COVIDwellbeingNI 
The campaign promotes Take 5 Steps to Wellbeing 
For tips on how to Take 5 visit: 
https://t.co/e7QWut6xyr
 #Take5Steps https://t.co/NeF5KjAADp"
1343134528118788097,2020-12-27 10:00:00,3,6,"If you are a #closecontact of someone who has tested positive for #COVID19 you must isolate for at least 10 days. Isolation means you must #Stayathome, away from others and have no visitors. 
Find out all you need to know at https://t.co/fmM1Isv1Dn https://t.co/PRrysIwFGf"
1342908038907367424,2020-12-26 19:00:01,1,1,"Mixing drugs can kill. It can increase the toxicity of the substances and cause organ failure. Don't mix any drugs. 

Read more on the dangers at https://t.co/BSFooX7slM

@NIDACTS @niada_info https://t.co/MKmnrOGLRs"
1342877842372259840,2020-12-26 17:00:01,2,8,"If you have any symptoms of COVID-19 – a new continuous cough, or high temperature, or change in your sense of taste or smell – don’t delay, book a test straight away.
Find out how at https://t.co/CoceczvmU2
While you’re waiting for your test or test result you must self-isolate. https://t.co/loNPFw6VH6"
1342840087227346945,2020-12-26 14:30:00,3,0,"A #hangover might make you feel bad for a day or so, but did you know that regularly drinking too much can seriously damage your #health?
Start to take control of your #drinking and find steps to reduce the risks associated with #alcohol by visiting https://t.co/IsLhW1hxBZ https://t.co/7K6TqQDWFr"
1342772261519044608,2020-12-26 10:00:29,3,2,"Need a recipe for your turkey leftovers? Our turkey and pepper stir fry, is quick easy and delicious.  Check out the recipe here https://t.co/fCByvb6ngT  #turkey #healthyrecipes #choosetolivebetter https://t.co/4iCi0lYiGk"
1342530763921752064,2020-12-25 18:00:51,1,1,"Many of us over-indulge at Christmas but overdoing it with alcohol could seriously damage your health, and drinking too much can have a negative impact on those around you.
Enjoy yourself safely this Christmas. Read more at https://t.co/GTnH3MMsBn https://t.co/Jz6ftOZk2E"
1342500356744302592,2020-12-25 16:00:02,4,4,"Don't forget that testing for COVID-19 remains open throughout the festive period. 
So if you have any of the symptoms don't delay, book a test straight away. 
Find out all the details including the location of testing nearest to you at https://t.co/CoceczdLvs

@healthdpt @mea_bc https://t.co/C3UqvG9Lb0"
1342470570101919745,2020-12-25 14:01:40,13,15,"Lifeline is available 24/7 during the holiday period. The
service  doesn’t close for any minute of any day including Christmas Day and Boxing Day.
If you or someone you know is in distress or despair call
the free-phone crisis helpline on 0808 808 8000. https://t.co/7pISX3Lpi0"
1342409755185217539,2020-12-25 10:00:01,6,3,"It is important to be aware of the guidance on mixing over the #Christmas holidays and to keep following the public health advice for #COVID19 to keep us all save – these steps may seem simple, but they are effective in reducing the spread. More info @ https://t.co/fmM1Isv1Dn https://t.co/9pTeCVhmzK"
1342168163773861891,2020-12-24 18:00:01,6,5,"See useful guide to mental and emotional wellbeing resources with easily accessible click-through links to websites and information. 
👉https://t.co/wGXrVpCgpE
The guide includes links to free online Stress Control classes, Healthcare Apps Library, bereavement supports and more. https://t.co/3n6Fyu1GGe"
1342077567768018944,2020-12-24 12:00:01,1,0,"12 Days of Christmas.
Dr Elfis Pressie from the Public 'Elf' Agency is offering 12 top tips ahead of Christmas to look after yours-elf over the festive period.

Day 12: Make sure you enjoy yourself this festive season! Have a healthy and happy Christmas and a great New Year! https://t.co/RnTcLoZQN1"
1342047370566098950,2020-12-24 10:00:01,3,3,Multi-Agency Triage team (MATT) Crisis De-escalation Service -available for those experiencing an acute mental health crisis that are in contact with emergency services by phoning 999 or 101 in Belfast and South Eastern Trust areas. To find out more visit https://t.co/RsQ6o91NgH https://t.co/dc0nQCSK3z
1342032413933842432,2020-12-24 09:00:35,8,8,"The health service is rolling out Covid-19 vaccination. Until large numbers  have been vaccinated we must still protect ourselves by: Keeping our distance, Wearing a face covering if required, Washing our hands  See  https://t.co/GiOI7lxzgi or talk to yr community pharmacy team. https://t.co/FWF5nvAl1B"
1341790675533238272,2020-12-23 17:00:00,1,0,"Teresa McClean, Registered Manager, Corriewood Nursing Home talks about the importance of the COVID-19 vaccine to her residents and her experience of the roll out of the vaccine in her nursing home. #COVID19Vaccine https://t.co/Sj22Ws2iaa"
1341766040976539655,2020-12-23 15:22:07,7,11,"Travelling into and staying in Northern Ireland? You need to self-isolate for 10 days from your date of arrival.

For more information, including on exemptions, see https://t.co/GiOI7lxzgi https://t.co/3mKs8rH54P"
1341677428029206529,2020-12-23 09:30:00,17,20,"Testing and contact tracing will remain operational throughout the festive season. 

So if you have any of the symptoms of COVID-19, don't delay, book a test straight away.

Read more at https://t.co/VSiOd1ci1C 
@healthdpt @RobinSwannMoH https://t.co/w37ElugXQt"
1341443391083610112,2020-12-22 18:00:01,4,4,"Parents don’t ignore signs of #type1diabetes during COVID-19 or because of Christmas holidays.
Children can develop #type1diabetes at any time – if symptoms develop, get your child’s blood sugar checked that day.
For further information see https://t.co/sNnZJGFo1B https://t.co/5d5ye3bPkf"
1341430549664194565,2020-12-22 17:09:00,36,50,A lot of people have said they are concerned about getting a coronavirus vaccine due to the speed at which they have been made. Here is a short video from the National Institute for Health Research (NIHR) with five reasons why people shouldn’t be worried. https://t.co/E6yUt4YJkD
1341398089597411329,2020-12-22 15:00:01,21,9,"Don’t forget to keep your distance this Christmas – When meeting up with friends and family always make sure there is space for Rudolf the red nosed reindeer between you at all times.
@NIYF
@voypic
@cypsp
@Actn4ChildrenNI
@nichildcom
@Ed_Authority
@Education_NI https://t.co/GoxkHMHIp3"
1341352793882447872,2020-12-22 12:00:01,2,3,"Dr Elfis Pressie from the Public 'Elf' Agency is offering 12 top tips ahead of Christmas to look after yours-elf over the festive period. ⛄️🎅❄️
Day 10: It's easy to overindulge over Christmas, so for some healthy tips and recipes, visit https://t.co/BSnAoDsknX https://t.co/Dpq5e0fMFi"
1341322588577001480,2020-12-22 10:00:00,8,4,"Prof Danny McAuley, Queen’s University of Belfast and BHSCT talks about vaccine safety and effectiveness.
#vaccination #VaccineSafety #COVID19 https://t.co/mfikgZkC3b"
1341126299788652545,2020-12-21 21:00:01,19,9,"Be a hero in your community.

Wear a face covering over your nose and mouth. Keep your distance. Wash your hands.

It could save lives. https://t.co/WibXBHnW1x"
1341096096228098059,2020-12-21 19:00:00,2,4,Our new #DigitalSelfTrace will send +tive cases a unique 6 digit DST code from 'HSCtracing' this code will provide them with access to an online platform. We will ask questions about the individuals health &amp; info on #closecontacts. Info @ https://t.co/rkxGQbTdNK #TestTraceProtect https://t.co/geFnJuza9y
1341065902620626944,2020-12-21 17:00:01,5,9,"*Button battery &amp; small toy warning ahead of #Christmas* We are warning parents &amp; guardians about the dangers of lithium button cell batteries, which are highly dangerous if accidentally swallowed, ensure toys are age-appropriate also. #childsafety Info @ https://t.co/EnKT0m2U3U https://t.co/Fq7M7Cewtg"
1341020603176857605,2020-12-21 14:00:01,6,8,"Keep following the public health advice for #COVID19 – these steps may seem simple, but they are effective in reducing the spread. More info @ https://t.co/fmM1IsdqLP https://t.co/SQ1v0DJdEa"
1340960202644889600,2020-12-21 10:00:00,17,9,"After any vaccine is licensed for use in the UK, it is monitored by the @MHRAgovuk.

This is an important part of making sure vaccines continue to meet safety standards on an ongoing basis.

Find out more:
https://t.co/znsNPk4rFt https://t.co/fsjtsXnMv5"
1340930007338770432,2020-12-21 08:00:01,5,10,"*Self-Isolation Update* 

If you are a close contact of someone who tests positive for #COVID19, you must self-isolate for 10 days. 

It had been 14 days until now. 

Self-isolation means you must stay at home, away from others.

More info at https://t.co/lSisoZ0qep https://t.co/SEaJrLvUgc"
1340748808498470912,2020-12-20 20:00:00,8,7,"Be a hero in your community.

Wear a face covering over your nose and mouth. Keep your distance. Wash your hands.

It could save lives. https://t.co/9wF2MvGj2R"
1340703512724971520,2020-12-20 17:00:01,3,3,We are reminding parents &amp;  guardians of young babies of the importance of following #safersleep advice. Following these steps as part of a sleep-time routine can reduce the risk of sudden infant death. For further information and to watch our video visit https://t.co/CToQbVPI27 https://t.co/myxfWKYChA
1340643113304551425,2020-12-20 13:00:00,4,3,We'll be running virtual public engagement sessions in Jan for anyone who wants to find out more about the consultation on an opt-out system for organ donation. You can submit a response in the meantime via https://t.co/OJ4QkdDN8K or find out more at https://t.co/6kJGFaWTdI https://t.co/RKrwKA9bRU
1340628012799307776,2020-12-20 12:00:00,3,1,"Dr Elfis Pressie is offering 12 top tips to look after yours-elf over Christmas.

Day 8: Face coverings can help protect you, your loved ones and the wider community from COVID-19, alongside handwashing and social distancing.

See https://t.co/lSisoZ0qep for more info. https://t.co/Ni1DKwRJyE"
1340597815714566147,2020-12-20 10:00:01,2,3,"With #TestTraceProtect anyone of us could be asked to self-isolate at any time. 

These tips for planning ahead will help make it easier if you are asked to stay at home. 

Learn more at https://t.co/GiOI7lPa7Q https://t.co/7y5G3rDrwK"
1340386421975072770,2020-12-19 20:00:00,5,4,"If you're choosing to drink alcohol this festive season please don't stockpile as it could increase the risk of you drinking more that you normally would.

Overdoing it with alcohol could seriously damage your health. 

Read more at https://t.co/GTnH3MuRcN

@healthdpt @NIDACTS https://t.co/kSNQxYs3lP"
1340341124192378881,2020-12-19 17:00:00,2,2,"Young people have been hospitalised after vaping 'spice'.

Reports suggest young people thought they were using cannabis oil but were unknowingly supplied with 'spice'.

Unregulated vaping substances can kill.

Find out more at https://t.co/hTJjIvvef7

@NIDACTS @niada_info https://t.co/89mdBMxhou"
1340310931327377409,2020-12-19 15:00:02,12,8,"Be a hero in your community.

Wear a face covering over your nose and mouth. Keep your distance. Wash your hands.

It could save lives.

@healthdpt https://t.co/4O2lseLZab"
1340265875509661696,2020-12-19 12:01:00,0,1,"Dr Elfis Pressie from the Public 'Elf' Agency is offering 12 top tips ahead of Christmas to look after yours-elf    
Day 7: Support for breastfeeding mums is important and many new online Breastfeeding Support Groups are now available. Find out more at https://t.co/lv7W7E8J2o https://t.co/KZrjudhAu8"
1340235429346328576,2020-12-19 10:00:01,6,4,"Vaccines go through several stages of lab tests and clinical trials before they can be approved for use.

Regulators review the results of these trials to check whether a vaccine meets the required levels of safety and effectiveness.

More info:
https://t.co/GRoi7mryS5 https://t.co/Sz0OKqFckL"
1340024036852723712,2020-12-18 20:00:01,8,2,"This Christmas the Allied Health Professionals are looking back with sincere gratitude to our colleagues across Health and Social Care. We wanted to find our own unique way to say a simple thank you.

🎶AHP NI &amp; friends sing Rocking Around the Xmas tree! 
https://t.co/DFOZO1l7Hm https://t.co/Ryu0aw0cER"
1340009175724789761,2020-12-18 19:00:58,6,3,"Vaccines are designed to prevent people from getting serious infectious diseases.

It is much safer for your immune system to learn how to fight illnesses through vaccination than by catching and treating them.

Read more:
https://t.co/znsNPjMQNV https://t.co/2JtyplwM77"
1339978739656998913,2020-12-18 17:00:01,5,4,"Learn more about Digital Self-Trace, the online contact tracing service, and how it helps stop the spread of coronavirus. #TestTraceProtect
Visit: https://t.co/MhmzvhaauG https://t.co/kLXTCYQqBZ"
1339957014550749190,2020-12-18 15:33:42,6,11,"Young people have been hospitalised after vaping 'spice'. 

Reports that young people thought they were using cannabis oil but were unknowingly supplied with 'spice'. 

Unregulated vaping substances can kill. 

Find out more at https://t.co/hTJjIvdDnz

@NIYF @VOYPIC @ParentingNI https://t.co/9QRiyxX8OL"
1339933773757091840,2020-12-18 14:01:21,25,18,Are you interested in finding out more about food and nutrition for yourself or your family? Dietitians are taking these online workshops throughout January. There’s something for everyone! Free and open to all. https://t.co/abqzwwbzYD
1339905234924126208,2020-12-18 12:07:56,5,2,"Dr Elfis Pressie is offering 12 top tips to look after yours-elf. Day 6: You can maintain contact with friends and family safely, meaning you don’t have to come into close contact, by using technology such as video calls: https://t.co/fmM1IsdqLP https://t.co/wfxF82pjUD"
1339873190202490881,2020-12-18 10:00:36,2,3,"It’s never too late to stop smoking to protect your health! If you want to quit, improve your chances of being successful by ordering your free Quit Kit from https://t.co/WVQDGQPYAD  and take that all important first step to protect your health today. https://t.co/k3MOeQKA2o"
1339849199526047744,2020-12-18 08:25:17,27,20,"Be a hero in your community.

Wear a face covering over your nose and mouth. Keep your distance. Wash your hands.

It could save lives. https://t.co/RvABqhvODj"
