id,created_at,favorite_count,retweet_count,text
1210531150210519040,2019-12-27 12:01:31,7,6,"At present, around 140 people in Northern Ireland are on the transplant waiting list. https://t.co/6kJGFaWTdI

#HAVETHECHAT https://t.co/bGjQfGhZgD"
1209987332260204545,2019-12-26 00:00:35,3,0,"Need a recipe for your turkey leftovers? Our turkey and pepper stir fry, is quick, easy and delicious. Check out the recipe here https://t.co/fCByvb6ngT #turkey #healthyrecipes #choosetolivebetter https://t.co/oYBtqHhBvj"
1209443855453605888,2019-12-24 12:01:00,2,3,"Have the chat with your family about becoming an organ donor.
https://t.co/6kJGFaWTdI

#HAVETHECHAT https://t.co/0qYejXJ75e"
1209421020114931712,2019-12-24 10:30:15,2,1,Help stop the spread of winter illnesses! More info @ https://t.co/QgN7KoFNTP https://t.co/T9Dk9zFGTN
1209383207348641793,2019-12-24 08:00:00,9,4,"Dr Elfis Pressie from the Public 'Elf' Agency is offering 12 top tips ahead of Christmas to look after yours-elf over the festive period. ⛄️🎅❄️

Day 12: Make sure you enjoy yourself this festive season! Have a healthy and happy Christmas and a great New Year! https://t.co/T7zpIK9dQf"
1209132784838750208,2019-12-23 15:24:55,1,2,"Mixing alcohol and cocaine can kill.

The mix is toxic and can cause fatal heart problems.

Don't mix any drugs.

Visit https://t.co/IZMNGtfpNZ for advice and support. https://t.co/w7Ik2r0OCX"
1209076706327384064,2019-12-23 11:42:05,13,13,"#Antibiotics don’t work against the cold and flu.
There are over-the-counter medications that you can get from your pharmacist to help treat the symptoms.
Find out more at one of the 500 community pharmacies taking part in the #LivingWellNI campaign.
Visit https://t.co/gSuT2F5Eyj https://t.co/LcjrXzPIAp"
1209020819231215621,2019-12-23 08:00:00,1,0,"Dr Elfis Pressie from the Public 'Elf' Agency is offering 12 top tips ahead of Christmas to look after yours-elf over the festive period. ⛄️🎅❄️

Day 11: There's no better gift than the gift of life. Sign the organ donor register and discuss your wishes: https://t.co/6kJGFaFhP8 https://t.co/MC7ZkuCKeY"
1208990759870959616,2019-12-23 06:00:33,1,3,Find out more at: https://t.co/AhPwAIA6IO https://t.co/dtlKbu3MMb
1208794495879389184,2019-12-22 17:00:40,11,9,Help stop the spread of winter illnesses! More info @ https://t.co/QgN7KoFNTP https://t.co/yDyQ03UFAH
1208658430917009408,2019-12-22 08:00:00,3,3,"Dr Elfis Pressie from the Public 'Elf' Agency is offering 12 top tips ahead of Christmas to look after yours-elf over the festive period. ⛄️🎅❄️

Day 10: It's easy to overindulge over Christmas, so for some healthy tips and recipes, visit https://t.co/BSnAoDsknX https://t.co/JxkkkCyz36"
1208371660639879170,2019-12-21 13:00:29,2,4,"Magnets have become popular among young people who use them as pretend piercings in or around the mouth, but they can be very dangerous if swallowed! If swallowed seek medical advice straight away! https://t.co/ipkpFRkkO6"
1208356704678817792,2019-12-21 12:01:03,4,4,"When families or friends know the wishes of their loved ones it makes the situation less stressful and can give them the confidence to fulfill your wish of being an organ donor.
https://t.co/6kJGFaWTdI

#HAVETHECHAT https://t.co/FMqw2vRCEr"
1208296043345002503,2019-12-21 08:00:00,5,2,"Dr Elfis Pressie from the Public 'Elf' Agency is offering 12 top tips ahead of Christmas to look after yours-elf over the festive period. ⛄️🎅❄️

Day 9: It's nice to rest over Christmas, but for ideas to get active and burn some mince pie calories, see https://t.co/hAaIiboPLU https://t.co/XqMXGtZhLj"
1207994323142430726,2019-12-20 12:01:04,9,5,"Emma Treanor, 36, from Newry has had two kidney transplants. 
Emma is sharing her story to highlight the importance of talking about organ donation. Read Emma’s story at: https://t.co/4x37cNrBWP

#HAVETHECHAT https://t.co/fos3Zqqqrh"
1207973848404168706,2019-12-20 10:39:43,8,7,"Ahead of the Christmas holidays, we are reminding parents &amp; guardians of young babies of the importance of following #safersleep advice to reduce the risk of sudden infant death.  https://t.co/fOIGUvMJwj"
1207933654456029184,2019-12-20 08:00:00,2,2,"Dr Elfis Pressie from the Public 'Elf' Agency is offering 12 top tips ahead of Christmas to look after yours-elf over the festive period. ⛄️🎅❄️

Day 8: If you're thinking about quitting smoking in the New Year, order your free Quit Kit today from https://t.co/OyRslvFQcB https://t.co/AnCpFtN938"
1207763785638801409,2019-12-19 20:45:00,6,6,"Mixing alcohol &amp; prescription drugs can be deadly.

Mixing means taking two or more drugs at the same time. This can include alcohol, over-the-counter medications, prescription drugs &amp; illegal drugs.

Find drug and alcohol support services in your area at https://t.co/IZMNGtx0Fx https://t.co/tGJegIFuu7"
1207682219134930947,2019-12-19 15:20:53,8,11,"Out for a a few drinks after work?
Think about the amount of alcohol you're drinking and it's impact on you and those around you.
Find out more info on alcohol units at https://t.co/IZMNGtfpNZ
@healthdpt @NIDACTS @niada_info https://t.co/Z4xqLzfYok"
1207571266573455361,2019-12-19 08:00:00,8,3,"Dr Elfis Pressie from the Public 'Elf' Agency is offering 12 top tips ahead of Christmas to look after yours-elf ⛄️🎅❄️

Day 7: If you're out and about over Christmas, check out https://t.co/lv7W7E8J2o for venues that are part of our Breastfeeding Welcome Here scheme. https://t.co/6uKDnE3Rg9"
1206892546468786176,2019-12-17 11:03:00,25,41,"#Buttoncellbattery warning ahead of #Christmas! They power many children’s toys, but are highly dangerous if accidentally swallowed, and can cause choking, burning or poisoning. Treat them the same way you would any poisonous substance – out of reach and out of sight. https://t.co/ztcHAIj88U"
1206891945727004673,2019-12-17 11:00:37,14,11,"When families or friends know the wishes of their loved ones it makes the situation less stressful and can give them the confidence to fulfill your wish of being an organ donor.
#HAVETHECHAT
https://t.co/6kJGFaWTdI https://t.co/xM1EoMNflG"
1206873211620732928,2019-12-17 09:46:10,6,7,"As the New Year approaches, the Public Health Agency is encouraging people to make a resolution worth keeping – quitting smoking. https://t.co/glcTvQEc3W https://t.co/p9MMDaOmOP"
1206846491257536512,2019-12-17 08:00:00,8,6,"Dr Elfis Pressie from the Public 'Elf' Agency is offering 12 top tips ahead of Christmas to look after yours-elf over the festive period.

Day 5: You can buy over-the-counter medicines, which don't need a prescription, and have them ready. Check out https://t.co/82NNpHhscy https://t.co/oWblpAZL0o"
1206561112176635904,2019-12-16 13:06:00,90,42,Watch Orla’s inspirational story and hear why she’s urging people to talk to their loved ones about organ donation #havethechat https://t.co/f0YEJykIUO
1206523307580940289,2019-12-16 10:35:47,14,26,"Most common illnesses don’t need #antibiotics and their symptoms can be treated with over-the-counter medicines.

Call in to your local pharmacist to find out more, as part of the Living Well campaign.

Visit https://t.co/gSuT2F5Eyj
#LivingWellNI https://t.co/2vUdLHq0qI"
1206484104797134848,2019-12-16 08:00:00,4,4,"Dr Elfis Pressie from the Public 'Elf' Agency is offering 12 top tips ahead of Christmas to look after yours-elf over the festive period.

Day 4: If you are planning on drinking alcohol over Christmas, set some limits.

Check out https://t.co/nTsi6ZgNni for info and advice. https://t.co/qG4BF3tu86"
1206121715530653697,2019-12-15 08:00:00,4,1,"Dr Elfis Pressie from the Public 'Elf' Agency is offering 12 top tips ahead of Christmas to look after yours-elf over the festive period.

Day 3: It’s important to keep warm to help protect against a drop in temperature. Find out more at https://t.co/CG64aGOaZE https://t.co/NaFy1fZAQ4"
1205872574770495489,2019-12-14 15:30:00,6,12,"Mixing alcohol and cocaine can kill.

The mix is toxic and can cause fatal heart problems.

Don't mix any drugs.

Visit https://t.co/IZMNGtx0Fx for advice and support.

#DontMix #weekend #alcohol #cocaine
@healthdpt @NIDACTS @niada_info https://t.co/uHGhGVgI1Y"
1205857588899913728,2019-12-14 14:30:27,5,5,"The message is clear – don’t take the risk; get the #FluVaccine! It’s free, it’s quick, and it could make a big difference to your health and the health of those close to you. More info @ https://t.co/QgN7KoFNTP https://t.co/5I5s2IkGJH"
1205759328352735233,2019-12-14 08:00:00,21,11,"Dr Elfis Pressie from the Public 'Elf' Agency is offering 12 top tips ahead of Christmas to look after yours-elf.

Day 2: It's important to look after your mental health over Christmas, and keep an eye out for others. Check out https://t.co/VrblhGIXKi for information and support. https://t.co/UzjVU7k0lT"
1205510661188530176,2019-12-13 15:31:53,3,5,"A #hangover might make you feel bad for a day or so, but did you know that regularly drinking too much can seriously damage your #health?

Start to take control of your #drinking and find steps to reduce the risks associated with #alcohol by visiting https://t.co/dJrnMqEFEA https://t.co/335fZGcqqx"
1205396939329507328,2019-12-13 08:00:00,9,3,"Dr Elfis Pressie from the Public 'Elf' Agency is offering 12 top tips ahead of Christmas to look after yours-elf.

Day 1: Around 50 per cent of falls are preventable. Take some simple steps to improve safety and help prevent falls: https://t.co/tGOKOBMXwK https://t.co/iDLN0t5w7Y"
1205159496659673088,2019-12-12 16:16:29,0,0,@BelfastTrust @NHSCTrust @healthdpt @SouthernHSCT @WesternHSCTrust @InspireWBGroup @AwareNI @amhNI
1205159494369644546,2019-12-12 16:16:28,35,35,"If you or someone you know is in crisis call Lifeline now on 0808 808 8000. Trained counsellors are ready to take your call immediately. Don't spend another night feeling trapped, hopeless and overwhelmed, help is out there. Lifeline can help you get through it. #YouAreNotAlone https://t.co/UMwLqTI2dk"
1205156481701744641,2019-12-12 16:04:30,0,0,@WesternHSCTrust @NHSCTrust @SouthernHSCT @healthdpt @BelfastTrust @InspireWBGroup @AwareNI
1205124616429219840,2019-12-12 13:57:53,11,8,"Flu vaccine reminder! Flu has recently started to circulate in here, so people should receive the vaccine before it spreads more widely. The sooner you get it, the better protected you will be! Info @ https://t.co/aR6sSdhw9P @healthdpt https://t.co/8D3Zr0ixjy"
1205095455689969664,2019-12-12 12:02:00,4,2,"Have you used the Regional HSC Hospital Passport? If so, we would like to hear your views and experiences. For more info see https://t.co/sYcaDivn4P https://t.co/nhvfjNqYCj"
1205093791826350080,2019-12-12 11:55:24,11,10,CONSULTATION DEADLINE EXTENDED. The Draft Mental Health and Suicide Prevention Training Framework is currently out for consultation. The deadline has been extended to FRIDAY 10th JANUARY. Please visit https://t.co/oHt2Snnqmy to respond to the consultation. https://t.co/3RiSIcIyRY
1204716702061285377,2019-12-11 10:56:58,103,73,"One wee chat could save up to 9 lives.
Talk to your loved ones today about being an organ donor #havethechat https://t.co/zsyKT3BktO"
1204411464624279552,2019-12-10 14:44:04,18,18,Colds &amp; Flu are best treated at home; choose the right service for your winter illness and #StayWellNI For information on how to help yourself stay well visit https://t.co/qBgMTtakxp https://t.co/uUqyH7V6cH
1204337666839498752,2019-12-10 09:50:49,9,11,REMINDER! Consultation closing on Thursday 12th December: Mental Health and Suicide Prevention Training Framework.  To view draft framework and to complete the survey monkey please visit:https://t.co/oHt2Snnqmy https://t.co/tCPnQCzll2
1203981482194284544,2019-12-09 10:15:28,10,12,"Do you know what #antibiotics really are and what they should be used for?

Find out more at one of the 500 community pharmacies taking part in the Living Well campaign.

Visit https://t.co/gSuT2F5Eyj 

#LivingWellNI
@healthdpt @compharmacyni @HSCBoard https://t.co/rmIJJTrFuB"
1203305759079124992,2019-12-07 13:30:23,7,14,"The message is clear – don’t take the risk; get the #FluVaccine! It’s free, it’s quick, and it could make a big difference to your health and the health of those close to you. More info @ https://t.co/QgN7KoFNTP https://t.co/iHSTkLO5Jb"
1203267912733265921,2019-12-07 11:00:00,2,3,"No one likes to have a #hangover.

If you choose to drink, know your limits by getting to know your units. It’s recommended that men and women drink no more than 14 units of alcohol per week.

Find out more at https://t.co/IsLhW1hxBZ https://t.co/IEdlahwPPB"
1203041419310567425,2019-12-06 20:00:00,4,4,"Mixing alcohol and ecstasy can be deadly.

Mixing means taking two or more drugs at the same time. This can include alcohol, over-the-counter medications, prescription drugs, and illegal or illicit drugs.

Find support services in your area at https://t.co/IZMNGtfpNZ https://t.co/4u5EX8CmEb"
1202961974868500481,2019-12-06 14:44:19,12,5,The weekend is almost here and it's a good opportunity to get out and get active. Walking is one the simplest and cheapest ways to introduce more activity into your daily life. Info at https://t.co/pwLlj3PHfd #choosetolivebetter https://t.co/zuYPxogVR7
1202606898614284289,2019-12-05 15:13:22,7,7,We are urging all eligible people whose health could be seriously affected by flu to get the free #fluvaccine! The vaccine does not give you the flu it is offered as the best protection for people in ‘at risk’ groups. Info @ https://t.co/qBgMTtakxp https://t.co/ocJqhYWdnJ
1202605744811659265,2019-12-05 15:08:47,9,9,"With the festive #party season getting into full flow, check out this helpful advice if you choose to drink alcohol.

Many of us over-indulge at #Christmas, but overdoing it with #alcohol could seriously damage your #health.

Find out more at https://t.co/Z2Ejd5Xgha https://t.co/A8hJjXAYXv"
1202158123601072128,2019-12-04 09:30:06,0,1,"Lorna quit smoking with the help of the stop smoking service. Find out how the stop smoking service helped her and could help you at https://t.co/AoOzFKJrKo 
#stopsmoking https://t.co/lH6Nh2a5ak"
1201908800321667072,2019-12-03 16:59:23,7,9,"Mixing drugs can be deadly.
If you or someone you know has a problem with drugs and/ or alcohol, find support services in your area at https://t.co/IZMNGtfpNZ
To find out more about the dangers of mixing, visit https://t.co/BSFooX7slM https://t.co/V9K83qJ13F"
1201511550412034049,2019-12-02 14:40:51,26,20,Need advice about antibiotics? Speak to your local pharmacist. More than 500 community pharmacies taking part in the #LivingWellNI campaign can give advice on the correct use of antibiotics &amp; self-care tips so you don’t have to visit the GP. Find out more https://t.co/tVsQVmujCZ https://t.co/b8DS4GuAJv
1201488897026514945,2019-12-02 13:10:50,10,9,There are loads of ways to be more active – many of them perfect for anyone who’s not been physically active for a while. Find out how to get more active at https://t.co/pwLlj3PHfd https://t.co/g4wDIUL5ae
1201101189674344449,2019-12-01 11:30:13,5,5,On #WorldAIDSDay we are encouraging everyone to practise safer sex and get tested early if they have put themselves at risk of getting #HIV and/or other #sexuallytransmittedinfections! More at https://t.co/DGLtf0RXLM https://t.co/DCaYpb07E6
1200516027982827521,2019-11-29 20:45:00,8,9,"Mixing #alcohol and prescription #drugs can be deadly.

Mixing means taking two or more drugs at the same time. This can include alcohol, over-the-counter medications, prescription drugs and illegal drugs.

Find support services in your local community at https://t.co/IZMNGtx0Fx https://t.co/REpZwvCOex"
1200443717213212672,2019-11-29 15:57:40,4,4,"It takes approximately one hour for one unit of alcohol to process through the body. On average a glass of #wine or a pint of #beer can take around 2.5 hours to process.

Do you know how much you’re drinking? Find info on alcohol &amp; its impact on you at https://t.co/IZMNGtfpNZ https://t.co/F9OA9O6Q2n"
1200081093543772161,2019-11-28 15:56:43,20,24,"We are urging everyone who is eligible to receive the free flu vaccine to make arrangements to get it to maximise their protection against the virus over winter. 

We are also highlighting the importance of hand hygiene and self-care to reduce the spread of winter infections. https://t.co/dKYrn1RxCm"
1199779932785672192,2019-11-27 20:00:01,1,1,"We're recruiting! Epidemiological Scientists.

To apply visit https://t.co/PYWMSDiaV1 https://t.co/EeFIGFOqeR"
1199715204931760128,2019-11-27 15:42:49,0,0,"@chemj4 Lifeline counsellors are experienced in dealing with suicide, self-harm, trauma and many other issues. Lifeline welcomes callers using Textphone service but cannot provide support by text. Hope that's helpful."
1199714928275406848,2019-11-27 15:41:43,0,0,@chemj4 1of2-Thanks for your feedback. Lifeline is a confidential service where callers disclose as much or as little as they choose. Counsellors will supportively encourage the person to provide their details in the hope Lifeline can connect the person to the most appropriate support.
1199686570049179648,2019-11-27 13:49:02,15,8,Cycling is a brilliant way to get out and about and explore your local area. Cycling is also a fantastic way to get fit and it’s environmentally friendly. Find out more at https://t.co/BSnAoDsknX https://t.co/Q1BnfhhjmB
1199630893230497792,2019-11-27 10:07:47,2,2,"Making the decision to quit smoking is one of the most important you can make about your health. Using one of the approved, free stop smoking services can increase your chances fourfold. https://t.co/AoOzFKJrKo #stopsmoking https://t.co/wCLi3mOAi4"
1199344746214199296,2019-11-26 15:10:44,2,0,@SouthernHSCT @NHSCTrust @healthdpt @WesternHSCTrust @BelfastTrust
1199344743387262988,2019-11-26 15:10:44,21,27,Lifeline is available 24/7 all year round FREE to call from all mobiles and landlines. It's a confidential service with crisis counsellors ready to support you with whatever you are going through. Don't waste another day or night in distress call Lifeline on 0808 808 8000 https://t.co/YMMrtyWNP4
1199021178116947968,2019-11-25 17:45:00,11,13,"Drugs &amp; alcohol support services are available in your local area. 
If you or someone you know might have a problem with drug and/or alcohol visit https://t.co/IZMNGtx0Fx for details getting help. Support is also available for those affected by a family member’s substance misuse. https://t.co/srhqfJFaHL"
1198970139842162688,2019-11-25 14:22:11,9,10,"All new mums can benefit from breastfeeding peer support, find out more at: https://t.co/Npw49oDxjM 
#breastfeedingisnotalwayseasy #breastfeeding https://t.co/32Q2c2Xhrm"
1198617271020802048,2019-11-24 15:00:01,19,16,"You won’t always get an antibiotic when you ask for one from your GP.

They’ll assess your symptoms and decide what the best treatment is for you.

Find out more antibiotics at https://t.co/gSuT2F5Eyj
#WAAW2019 #WorldAntibioticsAwarenessWeek #KeepAntibioticsWorking https://t.co/oBkwfjvCD1"
1198194480756723714,2019-11-23 11:00:00,7,10,"Do you know what antibiotics should be used for?

Find out at https://t.co/gSuT2F5Eyj

#WAAW2019  #WorldAntibioticsAwarenessWeek #antibiotics #AntibioticGuardian #KeepAntibioticsWorking
@healthdpt @HSCBoard @BelfastTrust @WesternHSCTrust @SouthernHSCT @setrust @NHSCTrust https://t.co/QvMZ0Ee8gM"
1197832296465883138,2019-11-22 11:00:48,11,4,"Antibiotics don’t work for all illnesses. If you see your GP they’ll assess your symptoms &amp; decide what the best treatment is for you. Find out more about the correct use of antibiotics at https://t.co/gSuT2F5Eyj #KeepAntibioticsWorking #WAAW2019 
#WorldAntibioticsAwarenessWeek https://t.co/jscLZcjv5Y"
1197807671174414336,2019-11-22 09:22:57,28,18,Being physically active helps maintain a healthy weight and can reduce the risk of many diseases. Being active is also good for mental health and can lift your mood. For further info visit https://t.co/Fx7hvIopqO https://t.co/ySQrFMW0vU
1197521954091274241,2019-11-21 14:27:37,121,129,That time of year again when #bugs and #germs are widespread. If your child is or has been unwell and you are wondering when then can return to #school check out our handy guide below! If concerned speak to your pharmacist or GP. More @ https://t.co/HQ7Q9lIBea https://t.co/GKWvG5aStY
1197511987778994176,2019-11-21 13:48:01,32,13,"Kicking off today's #Involvefest2019 Involvement Conference - great to hear from 
@hscpermsec @warner_md @PaulClark_UTV and Margaret Grayson, Chair of NI Cancer Research Consumer Forum, on the importance of having the patient voice heard in improving services https://t.co/1HsmTfp8X2"
1197488639770542080,2019-11-21 12:15:14,1,1,"Today is World Pancreatic Cancer Day. To find out more about pancreatic cancer visit https://t.co/4ZdPQb7YtS

#becanceraware #WorldPancreaticCancerDay https://t.co/91700aMPYB"
1197454935354425345,2019-11-21 10:01:18,4,0,"Get involved with today's events. To find out whats happening see:  https://t.co/8FzJXcpnBz
#InvolveFest2019 https://t.co/MjxJ7BfJGC"
1197235768290414604,2019-11-20 19:30:25,8,3,"Antibiotics don’t work for all illnesses. You won’t always get an antibiotic when you ask for one from your GP. They’ll assess your symptoms &amp; decide what the best treatment is for you.
Find out more about antibiotic use - https://t.co/gSuT2F5Eyj
#WAAW2019 #KeepAntibioticsWorking https://t.co/top1NtHr0X"
1197166086011203585,2019-11-20 14:53:31,14,19,"It’s #WorldAntibioticsAwarenessWeek! Do you know what #antibiotics are &amp; what they should be used for?
Find out at https://t.co/gSuT2F5Eyj 

#WAAW2019 #AntibioticGuardian #KeepAntibioticsWorking
@healthdpt @HSCBoard @BelfastTrust @WesternHSCTrust @NHSCTrust @SouthernHSCT @setrust https://t.co/l8adKheIFf"
1197101797246197760,2019-11-20 10:38:04,15,9,We have joined forces with @NSPCCNI and @SouthernHSCT to keep children safe from sexual abuse. The campaign will provide a range of resources and support to help ppl talk to children about staying safe and info on who to talk to if they’re upset or worried. #PANTS #UnderwearRule https://t.co/EKEmfMZJEK
1197099844067889152,2019-11-20 10:30:18,1,1,Studies show you're up to four times more likely to quit smoking with the stop smoking service. There is a free local Stop Smoking Service near you. Info at  https://t.co/AoOzFKJrKo  #stopsmoking https://t.co/kO8cB2wMZW
1197078239975542784,2019-11-20 09:04:27,53,21,"#Involvefest2019 - highlighting how Personal and Public Involvement (PPI) can help shape healthcare.
Find out more at https://t.co/qhj9QbPAef
#engageHSC https://t.co/6sWO6Ah4pJ"
1196869551453036544,2019-11-19 19:15:12,3,4,"Mixing drugs can be deadly.
If you or someone you know has a problem with drugs and/ or alcohol, find support services in your area at https://t.co/IZMNGtfpNZ
To find out more about the dangers of mixing, visit https://t.co/BSFooX7slM https://t.co/xr3ktq3Sln"
1196833712895340544,2019-11-19 16:52:47,7,9,"Teachers! Thinking of lessons and antibiotics for this #WorldAntibioticAwarenessWeek?
e-Bug has all you need to teach about #antibiotics &amp; test your knowledge with our #WAAW quiz!
Visit:
https://t.co/wr6zJx0UIz https://t.co/HzOTgqtx2q"
1196831217741631496,2019-11-19 16:42:53,14,11,"Important messages from @healthdpt  Tackling stigma and encouraging men to look after their mental health and reach out for support. #YouAreNotAlone 
Lifeline - NI's freephone crisis counselling helpline is available 24/7 on 0808 808 8000. https://t.co/5G5Eo8OIAn"
1196806476125364225,2019-11-19 15:04:34,3,0,"Our autumn vegetable curry is quick, easy and delicious.
Preparation time 10 mins, cooking time 25 mins. Guaranteed to warm you up on a day like today.
#choosetolivebetter #healthyrecipe https://t.co/yJ9CFOw9Xp https://t.co/VMbUlLimFK"
1196782962513268736,2019-11-19 13:31:08,8,3,"Health Improvement, Screening and Health Intelligence colleagues prepare to celebrate the second day of Involve Fest week. #involvefest2019 https://t.co/XTywf5a58J"
1196770834418941952,2019-11-19 12:42:56,17,0,"We are delighted to have won a Gold award at the @CIPR_UK PRide Awards, in collaboration with @HSCBoard. 

The award was presented for our Stay Well this Winter programme.

The judges said: ""This campaign punched above its weight... making this a truly standout campaign.” https://t.co/909E8SoBmH"
1196730047337566208,2019-11-19 10:00:52,6,6,"Antibiotics don’t work against the cold and flu.
This World Antibiotics Awareness Week, find out more about how to use antibiotics correctly by visiting https://t.co/gSuT2F5Eyj
#WAAW2019 #KeepAntibioticsWorking https://t.co/d9vEtMv0PI"
1196729822464135170,2019-11-19 09:59:58,0,0,@healthdpt @SouthernHSCT @NHSCTrust @InspireWBGroup @WesternHSCTrust @BelfastTrust
1196729820069191680,2019-11-19 09:59:57,55,44,"#InternationalMensDay if you think the man in your life whether- husband, partner, brother, father, friend seems to be struggling, support is available. Call Lifeline on their behalf (with their permission)as the first call can be difficult to make. 0808 808 8000. #YouAreNotAlone https://t.co/AhlNhnNXt7"
1196458763785506819,2019-11-18 16:02:53,23,27,"We are holding a series of stakeholder events to engage with users, service providers, families and other stakeholders about services we commission to build community capacity to help address health inequalities. 

For info and to book a place see: https://t.co/xjcHZa07Gt https://t.co/w0qWuEMiuD"
1196447283182739456,2019-11-18 15:17:15,7,5,#InvolveFest2019 - Find out what you can get involved with tomorrow at: https://t.co/8FzJXcpnBz there is an involvement roadshow at Royal Victoria Hospital or a coffee morning in the Southern Trust. #GetInvolved
