id,created_at,favorite_count,retweet_count,text
1294227645685694469,2020-08-14 11:01:30,3,9,Have symptoms of coronavirus? Get tested. For more information on what to do if you have symptoms and how and where to get a test visit https://t.co/SEQ40LZyQg  #COVID-19 #testing #coronavirus https://t.co/fQfVSa8Y5V
1294197293521018880,2020-08-14 09:00:54,2,4,"Local stop smoking services are free, friendly and make you up to four times more likely to quit for good. These services are staffed by trained expert advisers and provide a range of proven methods to help you quit. https://t.co/WVQDGQPYAD  #stopsmoking https://t.co/a8CyKVArv5"
1293948033042980864,2020-08-13 16:30:26,21,21,"This is a stressful time for students. Don't bottle up your feelings. If you need support with your mental health and emotional wellbeing, there are useful self-help guides, resources and helplines info available on the CovidwellbeingNI hub@ https://t.co/VrblhH0z8S https://t.co/BeFW4ILbVn"
1293927859199803393,2020-08-13 15:10:16,5,7,Our latest blog discusses what the evidence says about the association between excess weight and COVID-19 https://t.co/9xiIjNmRPX https://t.co/yFZQypXFvF
1293917011806806019,2020-08-13 14:27:10,10,18,"Clusters occurring in several districts: our second weekly data update on cluster numbers shows that since 24 May, a total of 11 clusters with five or more people have been identified. There have been 20 clusters with fewer than five people: https://t.co/nsKIS0r6lz https://t.co/w9lgOxjDCK"
1293864877799415808,2020-08-13 11:00:00,1,2,"Care Opinion is here in Northern Ireland. Care Opinion gives service users, families and carers the opportunity to share their experience of Health and Social Care. Your story can make a difference. Share your story at: https://t.co/9vN4TDpX8o
#CareOpinionNI #ihaveastoryNI https://t.co/29wN1YUyYu"
1293834678525243392,2020-08-13 09:00:00,5,10,We need your help! If you live in Northern Ireland you could help us find a vaccine for COVID-19. To register your interest or find out more see: https://t.co/RtXcteEmwV #bepartofresearch https://t.co/fTKYquBCMp
1293615736129126401,2020-08-12 18:30:00,4,4,"Mixing alcohol and prescription medication can be extremely dangerous. 

Don't mix any drugs.

Mixing substances can be unpredictable and cause serious harm and even death.

Find out more about the dangers of mixing at https://t.co/BSFooXp3dk

@healthdpt @NIDACTS https://t.co/QXbqYFu8av"
1293570357128048641,2020-08-12 15:29:41,29,47,"Taking three simple steps can help save lives:
1. Wash your hands regularly.
2. Keep social distancing (2 metres where possible).
3. Wear a face covering where social distancing is difficult to maintain. 
Help stop the spread of COVID-19. 
For more visit https://t.co/lSisoZ0qep https://t.co/PCpcwYY7R7"
1293550212749950976,2020-08-12 14:09:38,0,2,"Do you know how many units you drink? Give yourself an alcohol MOT at https://t.co/LNwfjEzUJk - assess your drinking and take steps to reduce your alcohol intake.

Drinking too much alcohol can have a serious impact on your health and wellbeing. https://t.co/NcJhYrQWj7"
1293502492504776704,2020-08-12 11:00:00,9,6,"Are you having problems sleeping? Do you need advice on nutrition and exercise and how to cope better with stress?

Then please visit  https://t.co/aTmFeE8oVB for a choice of quality assured apps.

 HealthcareNI apps library will help you maintain 
 good wellbeing &amp; mental health https://t.co/xvo4FyK0kz"
1293471031936446465,2020-08-12 08:55:00,2,12,"Don't forget the symptoms of COVID-19.

If you experience either a new continuous cough, high temperature, or a loss of, or change in sense of smell or taste, get tested. 

Find out more at https://t.co/lSisoYIOPP

@healthdpt https://t.co/H6wI8PondC"
1293183718207627265,2020-08-11 13:53:19,8,7,"PHA’s latest #blog looks at the importance of the NHS COVID-19 vaccine research registry and #COVID19 vaccine trials in Northern Ireland.
Read blog here: https://t.co/zOowXGa0dg https://t.co/eTYa8Gq75t"
1293140108414132226,2020-08-11 11:00:01,52,45,"Free Psychological First Aid E-learning module is still available for anyone working or volunteering across the statutory, voluntary and community sectors. 
For module details visit https://t.co/4k4aIQtdoA https://t.co/8oZ8GrcRdF"
1293109902689402880,2020-08-11 09:00:00,10,16,"If you live in Northern Ireland you can help us to find a vaccine for COVID-19. The COVID-19 vaccine registry allows members of the public to register their interest and be contacted to participate in clinical studies. 
To find out more and sign up see: https://t.co/RtXctemLFn https://t.co/TQOVycMtb4"
1292868310501974017,2020-08-10 17:00:00,65,50,Social distancing helps to stop the spread of #COVID19 - the fight is not over. Two metres remains the optimum distance to maintain physical distance where possible. Find out more by visiting https://t.co/lSisoYIOPP https://t.co/jj7imJlQ6s
1292824452284264448,2020-08-10 14:05:43,4,3,Our latest #COVID19 blog looks at COVID-19 Vaccine Trials in Northern Ireland. Find out more @ https://t.co/B10UkMldsf https://t.co/3qyNGpQ0xW
1292777714554814469,2020-08-10 11:00:00,10,11,#Testing &amp; #contact tracing will help break the chain of transmission of #COVID19. Successful contact tracing relies on every person in NI understanding what to do if they develop symptoms and following the public health advice. Get the facts @ https://t.co/fmM1Isv1Dn https://t.co/rxFhcYw0hC
1292747518724280322,2020-08-10 09:00:01,11,22,"Not sure how the #StopCOVIDNI app works?

Watch this short video for further info on the app and to find out why contact tracing is more effective when more of us use 'StopCOVID NI'

#downloadnow #contacttracing https://t.co/TcyViWR5Mr"
1292475725950455812,2020-08-09 15:00:00,15,14,"COVID-19 is still a danger. The fight is not over. 

Remember that good hand hygiene helps stop the spread of the virus. 

Wash your hands regularly for at least 20 seconds each time. 

Find out more at https://t.co/fmM1IsdqLP 

#COVID19 #coronavirus https://t.co/kJhaQi15UH"
1292445527662100481,2020-08-09 13:00:00,6,11,"Help find a vaccine for COVID-19. If you live in Northern Ireland you can 
sign up to give permission for researchers to contact you about taking part in COVID-19 vaccine studies. This will help us to carry out studies and find a vaccine faster. https://t.co/RtXctemLFn #covid19 https://t.co/6HygKXFamh"
1292385129432625153,2020-08-09 09:00:00,3,4,Share your experience of mental health services during COVID-19 pandemic at https://t.co/AhPwAIRHAm #10000morevoices https://t.co/zgyz2hR8yJ
1292083138353459205,2020-08-08 13:00:00,7,7,"Care Opinion gives service users, families and carers the opportunity to tell their story. Please tell your story to help improve the Health and Social Care services you use. Share your story at: https://t.co/9vN4TD8lJO #CareOpinionNI #ihaveastoryNI https://t.co/dS5pV1VzTO"
1292052939830435841,2020-08-08 11:00:00,10,12,"In addition to the 4 fixed #COVID19 testing sites, we also have #mobiletestingunits which are operating in different locations across NI. If you have symptoms get tested! For more info on locations &amp; how to get a test visit https://t.co/SEQ40LZyQg #COVID19 #testing #coronavirus https://t.co/a7YsdLghZP"
1292030288961445888,2020-08-08 09:30:00,9,5,"As we move forward, it is important to remember the guidance that has existed since #COVID19 emerged – these steps may seem simple, but they are effective in reducing the spread. More info @ https://t.co/fmM1IsdqLP https://t.co/zIHfOwjc7l"
1291767383129022464,2020-08-07 16:05:18,1,3,"It’s never too late to stop smoking to protect your health! If you want to quit, improve your chances of being successful by ordering your free Quit Kit from https://t.co/WVQDGQPYAD and take that all important first step to protect your health today. https://t.co/TMSDQMSad0"
1291741340133466113,2020-08-07 14:21:49,5,4,"During this #WorldBreastfeedingWeek our latest blog focuses on supporting breastfeeding for a healthier planet. 

Visit https://t.co/LagDe2Pdz7 to find out why breastfeeding matters and how we can all play our part in supporting breastfeeding mothers. https://t.co/qCEWlEZG5W"
1291722016782012427,2020-08-07 13:05:02,4,6,"Just by moving more every day, you can help improve your physical and mental health. Combined with healthy eating and drinking, regular physical activity is one of the best ways to manage your weight. https://t.co/viK9c90kFj https://t.co/881Xzb9sBT"
1291691374308360192,2020-08-07 11:03:16,3,6,Have symptoms of coronavirus? Get tested. For more information on what to do if you have symptoms and how and where to get a test visit https://t.co/SEQ40LZyQg  #COVID-19 #testing #coronavirus https://t.co/aFS2tCDMNS
1291670716631441409,2020-08-07 09:41:11,7,19,"As well as our drive-through #COVID19 test centres in Belfast, Derry/ Londonderry, Enniskillen and Craigavon, a mobile testing unit is now in Newcastle, Co Down. 

See https://t.co/SEQ40LZyQg for information on symptoms and to book a test. @nmdcouncil https://t.co/6wgw0YUF16"
1291660985909026817,2020-08-07 09:02:31,0,1,"Do you know the signs and symptoms of cancer? For information visit https://t.co/AZ5xqBmqjB If you have any of the signs and symptoms, please contact your GP. #BeCancerAware https://t.co/GKJzHAwGjs"
1291448962696777728,2020-08-06 19:00:01,8,10,"Care Opinion is here in Northern Ireland. It gives service users the opportunity to tell their story, to help improve the Health and Social Care services you use. Your story can make a difference.
Share your story at: https://t.co/9vN4TDpX8o
#CareOpinionNI #ihaveastoryNI https://t.co/UdFSGViksD"
1291383811331194881,2020-08-06 14:41:08,18,25,"If you or someone you know has experienced a bereavement during the COVID-19 pandemic, there are helpful booklets and resources available to provide advice and guidance.

Please visit https://t.co/U0bbR2oZ4s https://t.co/n6ShGwuAHS"
1291352243330056192,2020-08-06 12:35:41,25,28,"Our analysis of COVID-19 clusters across Northern Ireland has shown that they are occurring in both workplaces and communities. Since 25th May 2020, 23 clusters have been identified in total: https://t.co/zuTBmEPtuJ https://t.co/vDTny5HFpD"
1291328168100425729,2020-08-06 11:00:01,3,4,"If you live in Northern Ireland you can sign up to register your interest and be contacted to participate in clinical studies, which will help us find a COVID-19 vaccine faster. To find out more and sign up see: https://t.co/RtXcteEmwV
#COVID19 #bepartofresearch #findavaccine https://t.co/bd8zXcbVCY"
1291086572343840768,2020-08-05 19:00:00,5,5,It’s World Breastfeeding Week and a good opportunity to find out the facts about breastfeeding. If you want to find out what are truths and what are myths see: https://t.co/kVnPvwN88G #worldbreastfeedingweek #pregnant #breastfeeding https://t.co/LEH5RRjC1Y
1291056372264697856,2020-08-05 17:00:00,7,8,"Support for alcohol and drug misuse is available in your local area.

Throughout the pandemic these services have, and will continue to, support you. 

Find out where your nearest support service is by visiting https://t.co/IZMNGtfpNZ 

@healthdpt @NIDACTS https://t.co/UcxZtvnd3L"
1291003524382199808,2020-08-05 13:30:00,4,5,"Washing your hands frequently is an effective way to help stop the spread of COVID-19. 

Don't touch your face with unwashed hands. 

Find out more about how you can help stop the spread of coronavirus by visiting https://t.co/lSisoYIOPP

@healthdpt https://t.co/exRWvboN0t"
1290936970793963521,2020-08-05 09:05:32,32,39,"Free online Stress Control classes for August start on Monday 10th August for the next 6 weeks. 

For more information about the course and details about  how to take part, please visit https://t.co/KFPKMKHbPc

No need to register, simply click through to the website. https://t.co/dcCh9AKQ3X"
1290724183098273793,2020-08-04 19:00:00,2,5,Share your experience of mental health services during COVID-19 pandemic at https://t.co/AhPwAIRHAm #10000morevoices https://t.co/XUIHiza8O9
1290648688474300416,2020-08-04 14:00:01,36,28,"The Health Minister Robin Swann launches Care Opinion in Northern Ireland. Care Opinion gives service users the opportunity to tell their story about Health and Social Care services.
Share your story: https://t.co/9vN4TD8lJO 
https://t.co/cLECexXryU #CareOpinionNI #ihaveastoryNI https://t.co/kbPaDwjvbD"
1290603386320990209,2020-08-04 11:00:00,27,30,"We need your help!  If you live in Northern Ireland you could help us find a vaccine for COVID-19. To register your interest or find out more see: https://t.co/RtXcteEmwV
@healthdpt @HSCBoard @BelfastTrust @NHSCTrust @setrust @SouthernHSCT @WesternHSCTrust @PatientClient https://t.co/n3ZLsYMyEl"
1290573187344773120,2020-08-04 09:00:00,8,6,"Breastmilk is the only food specifically designed for your baby. As well as having all the nutrients your baby needs to grow and develop, human milk has very special ingredients such as antibodies, hormones and stem cells to help protect your baby. https://t.co/lv7W7E8J2o https://t.co/4rKfQh9NnF"
1290361800244916224,2020-08-03 19:00:01,0,4,"""I'm a breastfeeding mum - what does coronavirus mean for me?""
Our breastfeeding blog examines the advice and guidance for breastfeeding during coronavirus. You can read it at https://t.co/Y0Irnw4IVv 
#Worldbreastfeedingweek https://t.co/ZdDy5Th4RW"
1290299993090187265,2020-08-03 14:54:25,11,13,"Our latest #COVID19 blog covers looking after our own and our children’s emotions during COVID-19
Read more @ https://t.co/KSEDQfnvIL https://t.co/dBAFvr1zWD"
1290241002398052352,2020-08-03 11:00:01,2,6,#Testing &amp; #contact tracing will help break the chain of transmission of #COVID19. Successful contact tracing relies on every person in NI understanding what to do if they develop symptoms and following the public health advice. Get the facts @ https://t.co/fmM1Isv1Dn https://t.co/OyxqmFciQD
1290210492544192512,2020-08-03 08:58:47,54,44,"From today Care Opinion is available in Northern Ireland.
Service users have the opportunity to share their experience of Health and Social Care, whether good or could have been improved, please tell your story at https://t.co/9vN4TD8lJO
#CareOpinionNI #ihaveastoryNI https://t.co/nvXEmw0fof"
1289939012308869121,2020-08-02 15:00:01,4,8,"COVID-19 is still a danger. The fight is not over. 

Remember that good hand hygiene helps stop the spread of the virus. 

Wash your hands regularly for at least 20 seconds each time. 

Find out more at https://t.co/fmM1IsdqLP 

#COVID19 #coronavirus https://t.co/GE0qPO8rW2"
1289908813425004544,2020-08-02 13:00:01,24,14,"Care Opinion is an independent non-profit feedback platform and it's coming to Northern Ireland.
#CareOpinionNI #ihaveastoryNI @careopinion @jamesfm55 https://t.co/IKHKQTCI4v"
1289848414788653056,2020-08-02 09:00:00,5,3,There are breastfeeding peer supporters in all Trust areas. They are mummies who have breastfed their own children and want to help new mums.  If you want more information please visit https://t.co/lv7W7E8J2o or speak to your health care professional. #Worldbreastfeedingweek https://t.co/UdPBWM8hFk
1289561523736776706,2020-08-01 14:00:00,8,12,"Don't forget the symptoms of COVID-19 - if you experience either a new continous cough, high temperature, or a loss of, or change in sense of smell or taste, get tested. Find out more at https://t.co/lSisoZ0qep https://t.co/2ggnrpZI2f"
1289516389351317504,2020-08-01 11:00:39,2,3,"Local stop smoking services are free, friendly and make you up to four times more likely to quit for good. These services are staffed by trained expert advisers and provide a range of proven methods to help you quit. https://t.co/AoOzFL12BW   #stopsmoking https://t.co/dDJTG4Ruh9"
1289486024104706048,2020-08-01 09:00:00,8,3,The Breastfeeding welcome here scheme is an initiative that makes it easier for mums to recognise places where they can breastfeed their baby. Find businesses part of the Breastfeeding Welcome Here scheme at https://t.co/lv7W7EqkqY #Worldbreastfeedingweek https://t.co/ZLB6ImGWCZ
1289245071896915968,2020-07-31 17:02:32,3,2,"Do you know the signs and symptoms of cancer? For information visit https://t.co/AZ5xqBmqjB If you have any of the signs and symptoms, please contact your GP. #BeCancerAware https://t.co/TgE5gySDYg"
1289234579707113477,2020-07-31 16:20:51,11,8,"PHA is looking forward to taking part in @belfastpride  Virtual Parade online tomorrow (Sat. 1st August) between 1pm and 5pm. To find out more about some of the work and organisations PHA supports within the LGBTQ+ community please visit: https://t.co/vjcy02KJLM
#Bproud2020 https://t.co/p4EOsurynq"
1289203134313771008,2020-07-31 14:15:54,4,3,Our latest #COVID blog looks at harm reduction through needle and syringe exchange. We discuss the continued delivery of the Needle &amp; Syringe Exchange Scheme during the pandemic. More @ https://t.co/BituzJf2Ea #WorldHepatitisDay #HarmReduction https://t.co/qqjUtCQH6R
1289184563600609282,2020-07-31 13:02:06,5,10,"Taking part in physical activity can help to: improve your physical health, boost your mental health, help maintain a healthy weight and manage stress. Info on getting active at https://t.co/viK9c8IJgJ https://t.co/tLBBlP6Mrp"
1289153836280676357,2020-07-31 11:00:00,14,14,Share your experience of mental health services during COVID-19 pandemic at https://t.co/H0GX3ttCQC #10000morevoices https://t.co/bkI8PA8LAE
1289139026843316227,2020-07-31 10:01:09,9,5,The UV level will reach 5 in parts of NI today. Protect your skin and eyes when UV level is 3 or more. Check the UV index at https://t.co/cnlj2VrVbQ Further info at https://t.co/WdwS0pyhct  #careinthesun https://t.co/1KYEg5S28w
1289109965043572736,2020-07-31 08:05:40,11,12,PHA Special Update - StopCOVIDNI - https://t.co/xJDzvQzQqf
1289108852852621315,2020-07-31 08:01:15,1,3,Have symptoms of coronavirus? Get tested. For more information on what to do if you have symptoms and how and where to get a test visit https://t.co/SEQ40LZyQg  #COVID-19 #testing #coronavirus https://t.co/WjvUy8PCe2
1288897144942768129,2020-07-30 18:00:00,10,15,"The COVID-19 testing site in Derry/Londonderry has moved from the Rugby Club, to the Lycra car park (near The Rec Club), Maydown Works, 60 Clooney Road. 

If you have symptoms #GetTested

Find out more at https://t.co/CoceczdLvs

@dcsdcouncil @WesternHSCTrust https://t.co/jK1oyZ1YKs"
1288813104281911297,2020-07-30 12:26:03,3,3,"Watch this insightful conversation between Jurgen Klopp and Andrew Robertson about not bottling things up, talk to someone. Part of #SoundofSupport from #HeadsTogether.
If you need to speak to someone, NI's Lifeline 24/7 
free-phone helpline is always there for you.
0808 808 8000 https://t.co/3lLroRPN0d"
1288527205954445313,2020-07-29 17:30:00,10,10,"Do you know how much you're drinking at home? We mustn't forget that alcohol is a powerful drug. 

If you choose to drink get to know your units &amp; understand the serious impact it could be having on your health by visiting https://t.co/nrdRARt7NC

@healthdpt @NIDACTS @niada_info https://t.co/DsYLJoS2Hl"
1288479063884075010,2020-07-29 14:18:42,18,5,"The honours have been handed out for the inaugural Excellence in Hepatitis C Prevention, Testing &amp; Treatment Awards. Congratulations and thank you to all who provide a vital service in reducing the risks posed by hepatitis C in our community.
@setrust @ExternCharity @SU_NetworkNI https://t.co/jWpxo6BfA4"
1288442880311336965,2020-07-29 11:54:55,11,17,"Reminder! The closing date for a short-term funding programme for local communities is Thursday 6th August. 
The programme of investment will provide support to #communities responding to the impact of #COVID19 pandemic. 

Application info here: https://t.co/vfg2ZJiumx https://t.co/ONvOtplL5Q"
1288421511011815424,2020-07-29 10:30:00,5,5,"Washing your hands frequently is an effective way to help stop the spread of COVID-19. 

Don't touch your face with unwashed hands.

Find out more about how you can help stop the spread of coronavirus by visiting https://t.co/lSisoYIOPP

@healthdpt https://t.co/9LNjAJam7r"
1288407593107501059,2020-07-29 09:34:42,24,7,Rainbow Room resource boxes will be delivered to each of the 483 care homes across Northern Ireland over the coming weeks. #icpchange #rainbowbox https://t.co/pPgoZGz5nZ
1288174331189702656,2020-07-28 18:07:48,10,7,It's #WorldHepatitisDay &amp; did you know Needle &amp; Syringe Exchange Schemes help reduce hepatitis being transmitted &amp; put people in touch with healthcare professionals giving advice on keeping themselves &amp; the community they live in safe. Find out more at https://t.co/4SGxBlqUSB https://t.co/RQuIZ0I7Wr
1288145183188623360,2020-07-28 16:11:58,0,3,Have symptoms of coronavirus? Get tested. For more information on what to do if you have symptoms and how and where to get a test visit https://t.co/SEQ40LZyQg #COVID-19 #testing #coronavirus https://t.co/4iUgMRnTHh
1288086683641163778,2020-07-28 12:19:31,34,29,"Check out the updated TAKE 5 STEPS TO WELLBEING leaflet offering useful tips on supporting your mental and emotional wellbeing during the #COVID19 pandemic. 
Available here: https://t.co/Y2PrZcD6Ot 

#take5stepstowellbeing
#mentalwellbeing 
#emotionalwellbeing https://t.co/gVNmubGWBo"
1288044500741500928,2020-07-28 09:31:54,11,7,"This #WorldHepatitisDay we're encouraging anyone who thinks they may have been at risk of contracting viral hepatitis, to get tested. 

Treatment is available and can help save your life. 

Read more at https://t.co/frXGedjan7

#HepFreeFuture https://t.co/Na1suO0kU6"
1287809980272271361,2020-07-27 18:00:00,12,20,How does contact tracing for #COVID19 work? You will be contacted by the team on (028) 9536 8888 if you have received a positive result or have been identified as a #closecontact We will never ask for financial or social media details. Check out https://t.co/fmM1Isv1Dn for info. https://t.co/3lY3cYdZma
1287752958260719618,2020-07-27 14:13:25,9,5,Getting ahead of the curve? Our latest #COVID19 blog explains what epidemic curves are and why they are important?.#epidemiology Check it out @ https://t.co/uNOD9Jb5zi https://t.co/pcfJ6atB2D
1287674089549836295,2020-07-27 09:00:01,9,13,"If you have any of the coronavirus symptoms, stay at home and book a free test. #TestTraceProtect      

For more info go to https://t.co/mQePveBEv0. https://t.co/MWNQFOSbEx"
1287372098562744320,2020-07-26 13:00:01,5,4,"No one likes to have a hangover - if you choose to drink, get to know units &amp; take control of your drinking.

Find out more about alcohol units and the damage that drinking too much could be doing to your health by visiting https://t.co/IsLhW0ZWdp

@healthdpt @NIDACTS @niada_info https://t.co/ZAWqYtjaoj"
1287341897099304960,2020-07-26 11:00:00,26,19,"As we move forward, it is important to remember the guidance that has existed since #COVID19 emerged – these steps may seem simple, but they are effective in reducing the spread. More info @ https://t.co/fmM1Isv1Dn https://t.co/z6Hb3rPyIG"
1287296750814781441,2020-07-26 08:00:36,1,4,Have symptoms of coronavirus? Get tested. For more information on what to do if you have symptoms and how and where to get a test visit https://t.co/fmM1Isv1Dn  #COVID19 #GetTested https://t.co/HcnT92Rp2l
1287010009537290242,2020-07-25 13:01:12,8,5,Cycling is a brilliant way to get out and about and explore your local area. Cycling is also a fantastic way to get fit and it’s environmentally friendly. Find out more at https://t.co/viK9c90kFj https://t.co/2uGdaEqQGq
1286979509028130817,2020-07-25 11:00:00,22,22,#Testing &amp; #contact tracing will help break the chain of transmission of #COVID19. Successful contact tracing relies on every person in NI understanding what to do if they develop symptoms and following the public health advice. Get the facts @ https://t.co/fmM1Isv1Dn https://t.co/LQp62Q46lT
1286724395151630340,2020-07-24 18:06:16,2,2,"It’s never too late to stop smoking to protect your health! If you want to quit, improve your chances of being successful by ordering your free Quit Kit from https://t.co/WVQDGQPYAD and take that all important first step to protect your health today. https://t.co/8EgR2hUQqh"
1286677767841554439,2020-07-24 15:00:59,7,4,"Not a whizz in the kitchen, but want to eat better? Check out our healthy recipes @ https://t.co/Y0oCJVKOAE  #choosetolivebetter #healthyrecipes https://t.co/BIlV2sxNOC"
1286647515031502851,2020-07-24 13:00:46,4,4,COVID-19 is still a danger. The fight is not over. Remember that good hand hygiene helps stop the spread of the virus. Wash your hands regularly for at least 20 seconds each time. Find out more at https://t.co/fmM1IsdqLP #COVID19 #coronavirus https://t.co/3pQEB5dHWa
1286614665016082432,2020-07-24 10:50:14,8,3,Small steps can make a big difference. Walking is one of the simplest ways to get active. Try to take more steps each day and improve your health and wellbeing. Tips on getting active at https://t.co/BSnAoDsknX https://t.co/eoBv0Fe9yV
1286575506272509958,2020-07-24 08:14:38,8,15,Everyone in Northern Ireland with symptoms of coronavirus is eligible for testing. For more information on what to do if you have symptoms and how and where to get a test visit https://t.co/fmM1IsdqLP #COVID19 #GetTested https://t.co/PHFuRvbZ3R
1286300031843106817,2020-07-23 14:00:00,4,7,"As part of the Rapid Learning Initiative in Transmission of COVID-19 within Care Homes, 10,000 More Voices has opened surveys to learn from the experience of residents, relative and staff. For more information visit https://t.co/erjsFyHyUi
#10000morevoices https://t.co/YbZIFO97c9"
